article_id,source_id,url,title_hint,post_date,language,author_role,ai_stance,ai_type,disclosure_type,hypothesis_type,query_cluster,relevant_flag,post_stance_3,ai_visibility_group
22129,22,https://www.reddit.com/r/Steam/comments/1oi2tc3/how_do_i_filter_out_ai_generated_content_on_steam/,How do I filter out AI generated content on Steam?,,en,player,negative,art,,h3,,True,negative,visible_ai
22136,22,https://www.reddit.com/r/Steam/comments/1ixi3jf/steam_next_fest/,Steam Next Fest,,en,player,negative,art,,h3,,True,negative,visible_ai
16944,22,https://www.reddit.com/r/gamedev/comments/1h2uwkg/ethics_of_using_ai_art_for_placeholders_during/,Ethics of using AI art for placeholders during game development.,2024-11-29 23:22:40.000,en,developer,question,art,,h2,,True,neutral,visible_ai
16956,22,https://www.reddit.com/r/gamedev/comments/1t8n64d/what_do_you_think_is_actually_appropriate_to_use/,What do you think is actually appropriate to use AI for?,2026-05-10 00:09:58.000,en,outsider,neutral,gameplay,,h2,,True,neutral,visible_ai
16969,22,https://www.reddit.com/r/gamedev/comments/1r6czyu/looking_for_your_experience_regarding_game_art/,Looking for your experience regarding game art,2026-02-16 18:43:56.000,en,developer,neutral,art,,h2+h3,,True,neutral,visible_ai
16984,22,https://www.reddit.com/r/gamedev/comments/1j8wj1a/moving_roles_in_an_uncertain_future_ui_vfx/,Moving roles in an uncertain future (UI &gt; VFX),2025-03-11 20:36:41.000,en,developer,question,art,,h1,,True,neutral,visible_ai
16985,22,https://www.reddit.com/r/gamedev/comments/wba8nm/using_midjourney_text_based_ai_image_generation/,"Using Midjourney (text based AI image generation) for gamedev, some thoughts and examples",2022-07-29 20:10:02.000,en,developer,positive,art,,h1+h2,,True,positive,visible_ai
16994,22,https://www.reddit.com/r/gamedev/comments/1n99rpl/a_publisher_said_that_the_capsule_art_of_my_game/,"A publisher said that the capsule art of my game is ""seemingly AI generated"" and that it will ""likely be a big turn off for many people""",2025-09-05 19:23:30.000,en,developer,negative,art,discovered,h2+h3,,True,negative,visible_ai
17016,22,https://www.reddit.com/r/gamedev/comments/1ra9djd/after_a_year_of_customer_support_for_game_devs/,"After a year of customer support for game devs using AI, I've noticed three groups. Only two of them actually succeed.",,en,developer,neutral,tools,,h1,,True,neutral,internal_tools
17017,22,https://www.reddit.com/r/gamedev/comments/1ti2c9s/early_stage_game_prep_and_ai_art_place_holders_of/,Early Stage Game Prep and AI art Place Holders of Place Holders Art,,en,outsider,question,art,voluntary,h2+h3,,True,neutral,visible_ai
17031,22,https://www.reddit.com/r/gamedev/comments/1rciwdj/lessons_learned_developing_an_ai_game/,Lessons learned developing an AI game.,,en,developer,neutral,gameplay,,h2,,True,neutral,visible_ai
17054,22,https://www.reddit.com/r/gaming/comments/1h8tan8/a_use_for_ai_in_games_that_nobody_could/,A use for AI in games that nobody could reasonably complain about ,,en,player,positive,voice,,h2,,True,positive,visible_ai
17067,22,https://www.reddit.com/r/gaming/comments/10uv79n/i_have_to_addmit_i_would_buy_this_ai_generated/,I have to addmit I would buy this AI generated game!,,en,player,positive,general,,h2,,True,positive,general_discussion
17085,22,https://www.reddit.com/r/gaming/comments/1k5iu3t/frame_generation_is_it_ethical/,"Frame Generation, is it “Ethical”?",,en,player,question,general,,h2,,True,neutral,general_discussion
17095,22,https://www.reddit.com/r/gaming/comments/10sqy4f/videogame_npc_become_more_lifelike_due_to_ai/,Videogame NPC become more lifelike due to AI,,en,outsider,positive,voice,,h2,,True,positive,visible_ai
17160,22,https://www.reddit.com/r/Games/comments/13spe1t/developer_rayark_fired_all_their_artists_and/,Developer Rayark fired all their artists and replaced with AI. Everything being put out is of poor quality now,,en,player,negative,art,,h1,,True,negative,visible_ai
17166,22,https://www.reddit.com/r/Games/comments/1ofx6aw/arc_raiders_boss_boasts_of_being_able_to_ai/,"Arc Raiders boss boasts of being able to AI generate guns from Youtube videos, but says it'll never replace ""the human aspect"" - RPS",,en,player,neutral,general,,h1+h2,,True,neutral,general_discussion
17174,22,https://www.reddit.com/r/Games/comments/1m6ndz5/would_you_ever_buy_a_game_that_was_created_using/,Would you ever buy a game that was created using Ai?,,en,player,question,general,,h1,,True,neutral,general_discussion
17181,22,https://www.reddit.com/r/Games/comments/13wgrvg/david_gaider_ah_yes_the_dream_of_procedural/,"David Gaider: Ah, yes. The dream of procedural content generation. Even BioWare went through several iterations of this: ""what if we didn't need every conversation to be bespoke?"" Unlimited playtime with dialogue being procedurally created alongside procedural quests!",,en,developer,negative,gameplay,,h2,,True,negative,visible_ai
17210,22,https://www.reddit.com/r/Games/comments/1ogfqku/further_info_on_the_generating_3d_gun_models_from/,"Further info on the generating 3D gun models from YouTube videos via AI claim by the Embark CEO, seems to NOT be generative AI after all?",,en,player,neutral,general,,h1+h2,,True,neutral,general_discussion
17203,22,https://www.reddit.com/r/Games/comments/199zarc/gdc_2024_state_of_the_game_industry_game/,"GDC 2024 State Of The Game Industry: game developers on layoffs, generative AI, and more",2024-01-18 23:03:24.000,en,unclear,neutral,general,,h1,,True,neutral,general_discussion
17256,22,https://www.reddit.com/r/pcgaming/comments/1rsm1th/gamers_worst_nightmares_about_ai_are_coming_true/,Gamers’ Worst Nightmares About AI Are Coming True,,en,player,negative,general,,h1,,True,negative,general_discussion
17259,22,https://www.reddit.com/r/pcgaming/comments/1ro1e4k/looking_forwards_to_the_era_of_ownslop/,"Looking forwards to the era of ""ownslop""",,en,player,positive,general,,h1+h2,,True,positive,general_discussion
17264,22,https://www.reddit.com/r/pcgaming/comments/1oeqvpi/eas_ai_tools_reportedly_cost_game_devs_time_even/,EA's AI Tools Reportedly Cost Game Devs Time Even After a Year of Use,,en,developer,negative,general,,h1,,True,negative,general_discussion
17272,22,https://www.reddit.com/r/pcgaming/comments/1rya77n/nvidia_answers_my_dlss_5_questions/,Nvidia Answers my DLSS 5 Questions,,en,player,negative,art,,h2,,True,negative,visible_ai
17273,22,https://www.reddit.com/r/pcgaming/comments/1s34xw7/nvidia_ceo_says_i_dont_love_ai_slop_myself_after/,"Nvidia CEO says ""I don't love AI slop myself"" after giving Resident Evil Requiem's Grace a DLSS 5 makeover that was swiftly labelled AI slop",,en,developer,neutral,art,,h2,,True,neutral,visible_ai
17282,22,https://www.reddit.com/r/pcgaming/comments/10fzsl2/the_possibility_of_developing_games_using_todays/,The possibility of developing games using today's chat AI,,en,outsider,positive,voice,,h2,,True,positive,visible_ai
17286,22,https://www.reddit.com/r/pcgaming/comments/1955tjq/discussion_next_generation_of_games_using_llms_to/,Discussion: next generation of games using LLMs to power NPC dialogues,,en,developer,neutral,voice,,h1+h2,,True,neutral,visible_ai
17299,22,https://www.reddit.com/r/pcgaming/comments/1p6l8vd/a_viral_ai_clip_is_being_transformed_into_a/,"A viral AI clip is being transformed into a full-on RPG, but its creator promises it's ""free of AI-generated content""",,en,developer,neutral,art,voluntary,h2+h3,,True,neutral,visible_ai
17318,22,https://www.reddit.com/r/Steam/comments/1s5zn10/kingdom_come_deliverance_2_czech_translater_fired/,Kingdom Come Deliverance 2 Czech Translater Fired From Warhorse And Replaced With AI To “Save Finances”,,en,player,negative,voice,,h1,,True,negative,visible_ai
17319,22,https://www.reddit.com/r/Steam/comments/1qwulb0/a_push_for_integrity_and_transparency_in_gaming/,A Push for Integrity and Transparency in Gaming.,,en,player,negative,general,,h3,,True,negative,general_discussion
17323,22,https://www.reddit.com/r/Steam/comments/1t48kj1/what_do_you_guys_think_about_the_games_that_using/,What do you guys think about the games that using AI content in steam?,,en,player,negative,art,,h1+h2,,True,negative,visible_ai
17331,22,https://www.reddit.com/r/Steam/comments/1qxmrke/is_steam_using_ai_for_their_art_now/,Is steam using ai for their art now?,,en,player,negative,art,,h3,,True,negative,visible_ai
17336,22,https://www.reddit.com/r/Steam/comments/1ccm2at/does_steam_allow_ai_art_from_stable_diffusion/,Does Steam allow AI art from Stable diffusion ?,,en,developer,question,art,,h3,,True,neutral,visible_ai
17341,22,https://www.reddit.com/r/IndieGaming/comments/1t6zo7z/can_ai_realistically_help_a_nonprogrammer_with/,Can AI realistically help a non-programmer with game design/art experience solo-develop a game?,,en,outsider,question,tools,,h1,,True,neutral,internal_tools
17343,22,https://www.reddit.com/r/IndieGaming/comments/1nzyrcr/discussion_can_gamers_trust_an_indie_game_that/,‼️[Discussion] Can gamers trust an indie game that uses AI-generated visuals?,,en,developer,question,art,voluntary,h1+h2+h3,,True,neutral,visible_ai
17354,22,https://www.reddit.com/r/IndieGaming/comments/1n6tvmp/examples_of_nonevil_and_innovative_ai/,Examples of non-evil and innovative ai implementation?,,en,player,question,gameplay,,h2,,True,neutral,visible_ai
17356,22,https://www.reddit.com/r/IndieGaming/comments/1jfazso/first_time_indie_dev_update_the_good_the_bad_the/,"First Time Indie Dev Update: The Good, The Bad, The Ugly",,en,developer,neutral,art,voluntary,h2+h3,,True,neutral,visible_ai
17360,22,https://www.reddit.com/r/IndieGaming/comments/1s35wee/why_do_people_get_so_turned_off_by_ai_assets_in/,Why do people get so turned off by AI assets in games/apps?,,en,developer,question,art,,h1+h2,,True,neutral,visible_ai
17362,22,https://www.reddit.com/r/IndieGaming/comments/1skbhkg/thoughts_on_using_ai_art_for_indie_games/,Thoughts on using AI art for indie games?,,en,developer,question,art,,h1+h2,,True,neutral,visible_ai
17369,22,https://www.reddit.com/r/IndieGaming/comments/1rhjg00/ai_in_games_can_be_great_but_only_when_its_used/,"AI in games can be great, but only when its used effectively",,en,developer,positive,gameplay,,h2,,True,positive,visible_ai
22228,22,https://www.reddit.com/r/IndieGaming/comments/1t775og/no_ai_just_handcrafted_art/,"No AI, just handcrafted art",,en,developer,negative,art,,h1+h2,,True,negative,visible_ai
22231,22,https://www.reddit.com/r/IndieGaming/comments/1slxjin/about_to_release_but_someone_has_published/,About to release but someone has published something to look like a sequel?,,en,developer,question,art,discovered,h3,,True,neutral,visible_ai
17378,22,https://www.reddit.com/r/IndieGaming/comments/1ksuwei/im_using_ai_art_in_my_card_game_because_im_broke/,I'm using AI art in my card game because I'm broke. Is that unethical or just the indie reality in 2025?,,en,developer,question,art,voluntary,h1+h2,,True,neutral,visible_ai
17383,22,https://www.reddit.com/r/IndieGaming/comments/199pr8c/so_whats_the_final_verdict_on_ai_in_video_games/,"So, what's the final verdict on AI in video games?",,en,developer,neutral,art,voluntary,h2+h3,,True,neutral,visible_ai
17401,22,https://www.reddit.com/r/IndieGaming/comments/1tl6znp/is_using_ai_in_your_pipeline_really_unacceptable/,Is using AI in your pipeline really unacceptable if you are a solo indie dev with absolutely zero budget?,,en,developer,question,art,voluntary,h1+h2,,True,neutral,visible_ai
17402,22,https://www.reddit.com/r/IndieGaming/comments/1t3qhki/q_our_capsule_art_looks_like_ai_generated/,Q: Our capsule art looks like AI generated?,,en,developer,question,art,,h3,,True,neutral,visible_ai
17408,22,https://www.reddit.com/r/IndieGaming/comments/1q0iliw/heres_why_i_dont_use_ai_in_tyto/,Here's why I don't use AI in Tyto,,en,developer,negative,art,,h1+h2,,True,negative,visible_ai
17413,22,https://www.reddit.com/r/IndieGaming/comments/1sqtcnc/turned_my_paintings_into_a_game_world_how_does/,Turned my paintings into a game world. How does that look?,,en,developer,positive,art,voluntary,h2+h3,,True,positive,visible_ai
17423,22,https://www.reddit.com/r/IndieGaming/comments/1tjq820/im_making_a_hearthstone_inspired_card_game_and/,"I'm making a hearthstone inspired card game, and it's coming out next month for free",,en,developer,neutral,art,voluntary,h1+h2,,True,neutral,visible_ai
17426,22,https://www.reddit.com/r/IndieGaming/comments/1rg6van/i_dont_know_what_to_do/,I don't know what to do,,en,developer,question,art,voluntary,h1+h2,,True,neutral,visible_ai
17428,22,https://www.reddit.com/r/IndieGaming/comments/1nu76q1/292_wishlists_in_4_months_is_this_good_progress/,292 Wishlists in 4 Months – Is This Good Progress Without Paid Ads?,,en,outsider,neutral,art,voluntary,h2+h3,,True,neutral,visible_ai
17441,22,https://www.reddit.com/r/GameDevelopment/comments/1nzyu5r/discussion_can_gamers_trust_an_indie_game_that/,🧠 [Discussion] Can gamers trust an indie game that uses AI-generated visuals?,,en,developer,question,art,voluntary,h1+h2+h3,,True,neutral,visible_ai
17442,22,https://www.reddit.com/r/GameDevelopment/comments/1t7dcj6/confliction_and_a_bit_of_a_dilemma_with_the_game/,Confliction and a bit of a dilemma with the game I'm working on.,,en,outsider,question,tools,voluntary,h1+h3,,True,neutral,internal_tools
17455,22,https://www.reddit.com/r/GameDevelopment/comments/1pmp9kb/reddit_game_devs_and_ai/,Reddit Game Devs and AI,,en,outsider,positive,general,,h1+h2,,True,positive,general_discussion
17458,22,https://www.reddit.com/r/GameDevelopment/comments/1qmkxj9/im_making_a_game_with_ai_generation_tools_but_im/,I'm making a game with AI generation tools but I'm hesitant,,en,developer,question,art,voluntary,h1+h2,,True,neutral,visible_ai
17461,22,https://www.reddit.com/r/GameDevelopment/comments/1c61yyy/ai_researcher_wannabe_game_dev/,AI researcher wannabe game dev,,en,developer,neutral,art,voluntary,h1+h2,,True,neutral,visible_ai
17463,22,https://www.reddit.com/r/GameDevelopment/comments/1ojgkgn/ea_calls_ai_a_trusted_ally_for_game/,EA calls AI a “trusted ally” for game dev—accelerator or creativity killer?,,en,player,question,general,,h1,,True,neutral,general_discussion
17466,22,https://www.reddit.com/r/GameDevelopment/comments/1n5eoc8/ai_art_vs_artists/,Ai art vs artists,,en,player,question,art,,h1+h2,,True,neutral,visible_ai
17467,22,https://www.reddit.com/r/GameDevelopment/comments/1n5epeh/ai_vs_artists/,Ai vs artists,,en,player,question,art,,h1+h2,,True,neutral,visible_ai
17468,22,https://www.reddit.com/r/GameDevelopment/comments/1gndxju/what_is_your_opinion_on_ai_characters_in_a_game/,What is your opinion on AI characters in a game? Is there a right or wrong way to do it?,,en,developer,question,art,voluntary,h1+h2,,True,neutral,visible_ai
17469,22,https://www.reddit.com/r/GameDevelopment/comments/1k0vvpb/genuine_question_why_do_artists_make_less_than/,Genuine question: Why do artists make less than programmers in game dev?,,en,developer,question,art,,h1,,True,neutral,visible_ai
17476,22,https://www.reddit.com/r/GameDevelopment/comments/1r526p9/will_using_ai_get_you_automatically_ostracized/,Will using AI get you automatically ostracized?,,en,developer,question,art,voluntary,h1+h2+h3,,True,neutral,visible_ai
17478,22,https://www.reddit.com/r/GameDevelopment/comments/1snw5dq/ai_gamedev_and_the_future/,AI Gamedev... and the future..,,en,developer,neutral,general,,h1+h2,,True,neutral,general_discussion
17479,22,https://www.reddit.com/r/GameDevelopment/comments/1s9dnk1/using_ai_for_concept_art/,Using AI for concept Art?,,en,developer,neutral,art,voluntary,h2+h3,,True,neutral,visible_ai
17480,22,https://www.reddit.com/r/GameDevelopment/comments/1t98kb6/looking_for_developers_to_answer_questions_about/,Looking for developers to answer questions about generative AI for academic research - all experiences welcome,,en,developer,neutral,general,,h1+h2,,True,neutral,general_discussion
17503,22,https://www.reddit.com/r/GameDevelopment/comments/1ly3c0b/making_your_own_indie_games_as_a_writer/,Making your own indie games as a writer,,en,developer,neutral,art,,h1+h2,,True,neutral,visible_ai
17506,22,https://www.reddit.com/r/GameDevelopment/comments/1osz68f/halo_campaign_evolved_team_push_back_on_ai_hype/,Halo: Campaign Evolved team push back on AI hype,,en,developer,neutral,general,,h1,,True,neutral,general_discussion
17525,22,https://www.reddit.com/r/GameDevelopment/comments/1aie6eq/anyone_else_deeply_discouraged_by_ai/,Anyone else deeply discouraged by AI?,,en,developer,negative,art,,h1,,True,negative,visible_ai
17532,22,https://www.reddit.com/r/GameDevelopment/comments/1d5g3y5/sharing_resources_for_creating_assets_for_noobs/,Sharing resources for creating assets for noobs,,en,player,negative,general,,h3,,True,negative,general_discussion
17533,22,https://www.reddit.com/r/GameDevelopment/comments/1alqnhi/fear_and_hunger_art/,Fear and Hunger Art,,en,outsider,question,art,,h2,,True,neutral,visible_ai
17540,22,https://www.reddit.com/r/gamedev/comments/1tggzdl/just_read_the_full_2026_gdc_state_of_the_industry/,Just read the full 2026 GDC State of the Industry report. Two thirds of all the layoffs came from AAA studios,,en,developer,negative,general,,h1,,True,negative,general_discussion
17541,22,https://www.reddit.com/r/gamedev/comments/1ryl7ck/i_went_to_gdc_2026_so_you_didnt_have_to_it_was/,I went to GDC 2026 so you didn't have to -- it was worth it.,,en,developer,neutral,general,,h1+h2,,True,neutral,general_discussion
17544,22,https://www.reddit.com/r/gamedev/comments/1j11rhr/serious_discussionis_the_games_industry_dying/,Serious Discussion...Is the games industry dying?,,en,player,negative,general,,h1,,True,negative,general_discussion
17545,22,https://www.reddit.com/r/gamedev/comments/1nfz2bm/aspiring_indie_game_devs_how_do_you_keep_yourself/,"Aspiring indie game devs, how do you keep yourself motivated in this day and age?",,en,outsider,negative,art,,h1,,True,negative,visible_ai
17549,22,https://www.reddit.com/r/gamedev/comments/1e5huzu/opinions_on_using_chat_gpt_for_teaching_myself/,Opinions on using Chat GPT for teaching myself...,,en,developer,neutral,tools,,h1,,True,neutral,internal_tools
21170,22,https://www.reddit.com/r/GameDevelopment/comments/1q038mw/i_want_to_stop_using_generative_ai/,I want to stop using generative AI,,en,developer,negative,tools,,h1,,True,negative,internal_tools
17552,22,https://www.reddit.com/r/gamedev/comments/1jp0dri/how_are_big_studios_getting_around_steams_ai/,How are big studios getting around Steam's AI disclaimer?,,en,player,negative,general,,h3,,True,negative,general_discussion
17558,22,https://www.reddit.com/r/gamedev/comments/1t99e40/attention_big_game_studios_why_ai_isnt_going_to/,"Attention Big Game Studios: Why AI isn't going to save you, and, how indie devs can leverage it without losing their creativity.",,en,developer,negative,general,,h1+h2,,True,negative,general_discussion
17559,22,https://www.reddit.com/r/gamedev/comments/1r66h0c/lots_of_aishovelware_games_danger_for_indie/,Lots of AI-shovelware games - danger for indie content?,,en,developer,negative,general,,h1+h2,,True,negative,general_discussion
17560,22,https://www.reddit.com/r/gamedev/comments/1rglyjt/i_built_a_transparency_framework_for_ai_use_in/,I built a transparency framework for AI use in game development - think ESRB ratings meets Nutrition Facts,,en,developer,neutral,general,,h3,,True,neutral,general_discussion
17568,22,https://www.reddit.com/r/gamedev/comments/1qch1f7/will_ai_realistically_replace_game_animators/,Will AI realistically replace 'Game' animators?,,en,developer,question,art,,h1,,True,neutral,visible_ai
17571,22,https://www.reddit.com/r/gamedev/comments/1sty2af/postmortem_i_tried_and_failed_vibe_coding_a/,Post-mortem: I tried and failed vibe coding a metroidvania so you (hopefully) won't have to,,en,outsider,negative,tools,,h1,,True,negative,internal_tools
17574,22,https://www.reddit.com/r/gamedev/comments/1jwbe09/its_definitely_ai/,"""It's definitely AI!""",,en,developer,negative,art,,h2+h3,,True,negative,visible_ai
17575,22,https://www.reddit.com/r/gamedev/comments/1sytwe0/ai_in_modern_game_development_and_especially_qa/,AI in modern Game development and especially QA testing data for university project,,en,developer,neutral,general,,h1,,True,neutral,general_discussion
17577,22,https://www.reddit.com/r/gamedev/comments/1j20gyi/unpopular_opinion_ai_is_the_future_of_gaming/,Unpopular opinion: AI is the future of gaming.,,en,player,positive,voice,,h2,,True,positive,visible_ai
17583,22,https://www.reddit.com/r/gamedev/comments/1fd94ue/is_ai_changing_game_design_concerned_about_the/,Is AI changing game design? Concerned about the future of indie development...,,en,outsider,question,general,,h1+h2,,True,neutral,general_discussion
17584,22,https://www.reddit.com/r/gamedev/comments/1ojgn2h/1_in_5_steam_games_use_genai_help_or_harm_for/,1 in 5 Steam games use gen‑AI; Help or harm for game art?,,en,developer,neutral,art,,h1+h2,,True,neutral,visible_ai
17585,22,https://www.reddit.com/r/gamedev/comments/1m5z59t/i_am_eager_to_accelerate_game_dev_through_ai/,I am eager to accelerate game dev through AI.,,en,developer,positive,tools,,h1+h2,,True,positive,internal_tools
17601,22,https://www.reddit.com/r/gamedev/comments/1f35ttj/how_do_you_market_a_game_that_has_ai_art/,How do you market a game that has AI art?,,en,developer,question,art,voluntary,h2+h3,,True,neutral,visible_ai
17606,22,https://www.reddit.com/r/gamedev/comments/1l2yw2s/starting_a_game_studio_in_india_with_1_cr_120k_is/,Starting a Game Studio in India with ₹1 Cr (~$120K) – Is This Feasible? Seeking Insight from Indie Devs,,en,outsider,neutral,art,,h1+h2,,True,neutral,visible_ai
17608,22,https://www.reddit.com/r/gamedev/comments/1cgbjcb/indie_postmortem_for_a_mobile_game_with_ai_art_in/,Indie postmortem for a mobile game with AI art in it,,en,developer,neutral,art,voluntary,h2+h3,,True,neutral,visible_ai
17609,22,https://www.reddit.com/r/gamedev/comments/1jup6un/are_game_companies_really_using_music_ai/,Are Game companies really using music AI?,,en,developer,question,voice,,h2,,True,neutral,visible_ai
17612,22,https://www.reddit.com/r/gamedev/comments/18mjewm/where_does_valve_draw_the_line_on_ai_use_in_game/,Where Does Valve Draw the Line on AI Use in Game Development?,,en,developer,negative,voice,,h3,,True,negative,visible_ai
17614,22,https://www.reddit.com/r/gamedev/comments/1pjygg4/former_steams_game_discovery_dev_on_the_current/,"Former Steam's game discovery dev on the current state of the market: ""The discovery ecosystem is more broken now than I've ever seen it in my decades in the industry. [...] If you're a game developer reading this: it's not just you! You can do everything right and still fail.""",,en,developer,neutral,general,,h1,,True,neutral,general_discussion
17632,22,https://www.reddit.com/r/gaming/comments/1s0bjl1/ubisoft_lays_off_100_at_redstorm_ent/,"Ubisoft lays off 100 at Redstorm Ent, restructuring and 'accelerating its investment in ""player-facing generative AI.""'",,en,developer,negative,art,,h1,,True,negative,visible_ai
17634,22,https://www.reddit.com/r/gaming/comments/1prottw/official_statement_from_the_indie_game_awards/,Official Statement from the Indie Game Awards: 'Clair Obscur: Expedition 33' and 'Chantey's' awards retracted and awarded instead to 'Sorry We’re Closed' and 'Blue Prince' due to GenAI usage,,en,developer,negative,art,discovered,h2+h3,,True,negative,visible_ai
17638,22,https://www.reddit.com/r/gaming/comments/1ofbkyb/halo_remake_director_on_if_the_game_is_using_ai/,"Halo remake director on if the game is using AI: ""“It’s a tool in a toolbox. We use Photoshop. There’s generative fill, for example. The boundary lines can get a little fuzzy.""",,en,developer,neutral,art,,h2+h3,,True,neutral,visible_ai
17650,22,https://www.reddit.com/r/gaming/comments/1po3zuw/divinity_is_confirmed_to_be_turn_based_planning/,"Divinity is confirmed to be turn based, planning to do early access again and Swen comments on Larian's use of AI- Bloomberg",,en,developer,neutral,art,voluntary,h1+h2,,True,neutral,visible_ai
17655,22,https://www.reddit.com/r/gaming/comments/1oydn1f/black_ops_7s_egregious_use_of_ai_makes_me/,Black Ops 7's egregious use of AI makes me extremely depressed.,,en,player,negative,art,,h1+h2,,True,negative,visible_ai
17657,22,https://www.reddit.com/r/gaming/comments/1t4l26j/new_xbox_ceo_overhauls_leadership_by_bringing/,New xbox CEO overhauls leadership by bringing executives from CoreAI and Instacart over amid sinking sales,,en,developer,negative,general,,h1,,True,negative,general_discussion
17659,22,https://www.reddit.com/r/gaming/comments/1lnhj00/fans_slam_the_alters_after_discovering_evidence/,"Fans slam The Alters after discovering evidence of undisclosed gen AI in images, text, and translation",,en,player,negative,general,discovered,h2+h3,,True,negative,general_discussion
17669,22,https://www.reddit.com/r/gaming/comments/1lrk5lw/is_it_even_going_to_be_possible_to_avoid_ai_in/,Is it even going to be possible to avoid AI in gaming going forward?,,en,player,negative,general,discovered,h2+h3,,True,negative,general_discussion
17686,22,https://www.reddit.com/r/gaming/comments/1d12cr1/will_ai_speed_up_game_development/,Will AI speed up game development?,,en,player,positive,general,,h2,,True,positive,general_discussion
17689,22,https://www.reddit.com/r/gaming/comments/1enbdd1/the_impact_of_genai_generative_artificial/,The impact of GenAI (Generative Artificial Intelligence) on video games,,en,outsider,positive,general,,h1+h2,,True,positive,general_discussion
17690,22,https://www.reddit.com/r/gaming/comments/1csulgr/can_ai_filler_dialogue_be_useful_in_some_game/,Can AI filler dialogue be useful in some game contexts?,,en,player,neutral,voice,,h2,,True,neutral,visible_ai
