article_id,source_id,url,title_hint,post_date,language,author_role,ai_stance,ai_type,disclosure_type,hypothesis_type,query_cluster,relevant_flag,post_stance_3,ai_visibility_group
17694,22,https://www.reddit.com/r/gaming/comments/1rzqeb5/the_more_we_learn_about_crimson_desert_and_pearl/,"The More we Learn about Crimson Desert (and Pearl Abyss), the Worse it Seems",,en,player,negative,art,discovered,h2+h3,,True,negative,visible_ai
17698,22,https://www.reddit.com/r/gaming/comments/1oyqg8p/people_are_rioting_over_codbo7_using_ai_images/,"People are rioting over CoD:BO7 using AI images. Meanwhile, Where Winds Meet (a Netease gasha ARPG) is using ChatGPT-like NPCs.",,en,player,neutral,general,,h1+h2,,True,neutral,general_discussion
17704,22,https://www.reddit.com/r/gaming/comments/1qjxidk/lets_try_to_create_the_ten_commandments_that/,Let’s try to create the Ten Commandments that gamers should try to follow to preserve the best health of our hobby.,,en,player,negative,general,,h1,,True,negative,general_discussion
17714,22,https://www.reddit.com/r/gaming/comments/1g3ioc0/how_bethesda_can_get_back_on_track_and_make_the/,How Bethesda can get back on track and make The Elder Scrolls VI incredible ,,en,player,neutral,general,,h1,,True,neutral,general_discussion
17715,22,https://www.reddit.com/r/gaming/comments/1ek4jmb/what_are_some_predictions_you_have_about_the/,What are some predictions you have about the future/near future of gaming or the industry in general??,,en,player,negative,general,,h1,,True,negative,general_discussion
17744,22,https://www.reddit.com/r/Games/comments/1kdb4no/compulsion_games_boss_generative_ai_usage_is_not/,Compulsion Games boss: Generative AI usage 'is not mandated' at Xbox,,en,developer,neutral,general,,h1,,True,neutral,general_discussion
17756,22,https://www.reddit.com/r/Games/comments/18tso7v/first_world_problems_we_need_to_start_discussing/,First world problems: we need to start discussing AI and its adoption into the workload of the gaming industry.,,en,player,neutral,voice,,h1+h2,,True,neutral,visible_ai
17763,22,https://www.reddit.com/r/Games/comments/19biyix/gdc_2024_state_of_the_game_industry_devs_discuss/,"GDC 2024 State Of The Game Industry: Devs Discuss Layoffs, Generative AI, and More",2024-01-20 21:58:07.000,en,unclear,neutral,general,,h1,,True,neutral,general_discussion
17869,22,https://www.reddit.com/r/IndieGaming/comments/1m51k5b/ai_use_in_indie_game_development/,AI Use in Indie Game development,,en,unclear,neutral,general,,h1+h2,,True,neutral,general_discussion
17870,22,https://www.reddit.com/r/IndieGaming/comments/1kfxhpt/do_game_devs_tell_studios_or_publishers_when_ai/,Do Game Devs Tell Studios or Publishers When AI Writes Half Their Code?,,en,developer,question,tools,,h3,,True,neutral,internal_tools
17917,22,https://www.reddit.com/r/IndieGaming/comments/1p93uje/we_will_soon_enter_the_golden_age_of_gaming/,We will soon enter the Golden Age of Gaming,,en,player,positive,general,,h1+h2,,True,positive,general_discussion
17966,22,https://www.reddit.com/r/GameDevelopment/comments/14pwmcg/valve_responded_to_the_alleged_banning_of_ai/,"Valve responded to the alleged ""banning"" of AI generated games on Steam",,en,outsider,positive,general,,h1+h2,,True,positive,general_discussion
17968,22,https://www.reddit.com/r/GameDevelopment/comments/167xvz2/i_believe_triple_a_game_studios_are_going_to/,"I believe 'triple A' game studios are going to dissolve and eventually vanish, and indie devs and smaller studios with fresh ideas will dominate the industry.",,en,player,positive,general,,h1,,True,positive,general_discussion
22408,22,https://www.reddit.com/r/gamedev/comments/1isz0us/will_ai_hit_the_video_game_industry_as_hard_as_it/,Will AI hit the video game industry as hard as it will Hollywood?,,en,player,neutral,general,,h1,,True,neutral,general_discussion
17991,22,https://www.reddit.com/r/GameDevelopment/comments/1ptp6tu/another_question_about_expedition_33_and_now/,Another question about Expedition 33 (and now Divinity) narratives,,en,player,positive,general,voluntary,h2+h3,,True,positive,general_discussion
18001,22,https://www.reddit.com/r/GameDevelopment/comments/1k9082k/what_does_the_future_hold_for_indie_games/,What does the future hold for indie games?,,en,player,neutral,general,,h1+h2,,True,neutral,general_discussion
18005,22,https://www.reddit.com/r/GameDevelopment/comments/1bibkkd/would_you_use_a_tool_like_dalle_or_midjourney_to/,Would you use a tool like Dall-E or Midjourney to moodboard visuals/characters/aesthetics?,,en,developer,question,art,,h2+h3,,True,neutral,visible_ai
18012,22,https://www.reddit.com/r/gamedev/comments/1td4f8z/what_is_your_current_take_on_using_ai_art_in_games/,What is your current take on using AI art in games?,,en,developer,question,art,,h2,,True,neutral,visible_ai
18013,22,https://www.reddit.com/r/gamedev/comments/1ry0hlr/is_ai_art_justified_for_solo_indie_developers/,Is AI art justified for solo indie developers?,,en,developer,question,art,,h1+h2,,True,neutral,visible_ai
18014,22,https://www.reddit.com/r/gamedev/comments/1pd0zlh/a_question_about_ai_use_in_game_devs_im_courious/,a question about AI use in game devs.  I'm courious if my view on it is odd.,,en,developer,positive,art,voluntary,h2,,True,positive,visible_ai
18015,22,https://www.reddit.com/r/gamedev/comments/16dh6re/use_of_generative_ai_in_games_backlash_in_code_vs/,Use of Generative AI in Games - Backlash in Code VS Art,,en,developer,neutral,general,,h1+h2,,True,neutral,general_discussion
18016,22,https://www.reddit.com/r/gamedev/comments/1ntlaxz/will_heavy_ai_use_for_assets_tank_our_zerobudget/,Will Heavy AI Use for Assets Tank Our Zero-Budget Indie Game on Steam?,,en,developer,question,art,voluntary,h1+h2,,True,neutral,visible_ai
18017,22,https://www.reddit.com/r/gamedev/comments/1ct670e/regarding_ai_grad_student_and_artrelated_fields/,Regarding AI Grad Student and Art-Related Fields,,en,developer,negative,art,,h1,,True,negative,visible_ai
18019,22,https://www.reddit.com/r/gamedev/comments/1o19oze/developer_crushed_out_i_have_launched_my_steam/,"Developer Crushed Out: I have launched my Steam page in May. Three and half months later, only hit 400 wishlists. Here's what I made wrong.",,en,developer,negative,art,discovered,h2+h3,,True,negative,visible_ai
22419,22,https://www.reddit.com/r/gamedev/comments/yox3m9/ai_game_upscaling_and_remakes/,AI game upscaling and remakes,,en,player,positive,art,,h2,,True,positive,visible_ai
22420,22,https://www.reddit.com/r/gamedev/comments/1qqy1l5/what_are_your_thoughts_on_the_new_google_genie/,What are your thoughts on the new Google Genie Project?,,en,player,neutral,general,,h2,,True,neutral,general_discussion
18024,22,https://www.reddit.com/r/gamedev/comments/1oyxl1x/blow_for_openai_in_germany_as_court_rules_song/,"Blow for OpenAI in Germany as court rules song lyrics used illegally, means people using AI art in their games risk the same thing happening to them if the AI doesn't have the license for the material used to train on.",,en,player,negative,art,,h3,,True,negative,visible_ai
18025,22,https://www.reddit.com/r/gamedev/comments/1mlb526/accused_of_using_ai_art/,Accused of using AI art,,en,developer,negative,art,discovered,h3,,True,negative,visible_ai
18026,22,https://www.reddit.com/r/gamedev/comments/1tdz7y4/is_ai_for_storygame_design_not_art_frowned_upon/,Is AI for story/game design (not art) frowned upon? (Got destroyed last time),,en,developer,question,general,,h1+h2,,True,neutral,general_discussion
18028,22,https://www.reddit.com/r/gamedev/comments/1s4dbmf/do_you_actually_care_about_ai_art_in_video_games/,"Do you actually care about AI art in video games, or do you just care about getting caught?",,en,developer,neutral,art,,h2+h3,,True,neutral,visible_ai
18030,22,https://www.reddit.com/r/gamedev/comments/1s9mkt1/ai_art_vs_ai_code/,AI art vs AI code,,en,player,neutral,art,,h1+h2,,True,neutral,visible_ai
18035,22,https://www.reddit.com/r/gamedev/comments/1sr2nms/what_counts_as_a_game_made_by_ai/,What counts as a game made by AI?,,en,developer,question,tools,,h1+h3,,True,neutral,internal_tools
18038,22,https://www.reddit.com/r/gamedev/comments/1r21gax/game_dev_veterans_do_you_feel_the_same_way_about/,"Game Dev Veterans: do you feel the same way about vibecoding, as musicians do about AI generated music?",,en,developer,question,art,,h1+h2,,True,neutral,visible_ai
22424,22,https://www.reddit.com/r/gamedev/comments/1sq5jqt/is_it_really_worth_it_to_learn_gamedev_in_2026/,Is it really worth it to learn gamedev in 2026 ?,,en,outsider,question,general,,h1+h2,,True,neutral,general_discussion
22427,22,https://www.reddit.com/r/gamedev/comments/1q31nrp/codex_mortis_is_not_100_ai_developed/,Codex Mortis is NOT 100% AI developed.,,en,developer,neutral,tools,,h1+h3,,True,neutral,internal_tools
18043,22,https://www.reddit.com/r/gamedev/comments/1omu0vx/ethical_question_on_ai_art/,Ethical question on AI art,,en,developer,question,art,,h3,,True,neutral,visible_ai
18044,22,https://www.reddit.com/r/gamedev/comments/1q4rgbv/if_youre_using_any_of_the_big_three_engines_then/,If you're using any of the big three engines then your game contains AI generated code that should technically be disclosed on Steam,,en,developer,neutral,tools,,h3,,True,neutral,internal_tools
18046,22,https://www.reddit.com/r/gamedev/comments/1nanfg9/how_much_generative_ai_content_do_you_tolerate_in/,How much generative AI content do you tolerate in an indie game?,,en,player,question,art,,h1+h2,,True,neutral,visible_ai
18047,22,https://www.reddit.com/r/gamedev/comments/1md09fn/ai_in_art/,AI in Art,,en,developer,question,art,voluntary,h1+h2,,True,neutral,visible_ai
18049,22,https://www.reddit.com/r/gamedev/comments/1rw3cx4/have_you_experienced_ethical_issues_with_ai_use/,Have you experienced ethical issues with AI use in a game dev team?,,en,developer,neutral,general,,h1+h2,,True,neutral,general_discussion
22431,22,https://www.reddit.com/r/gamedev/comments/1pu8hu2/question_about_ai_and_good_usage_of_it/,Question about AI and good usage of it,,en,developer,neutral,tools,,h3,,True,neutral,internal_tools
18052,22,https://www.reddit.com/r/gamedev/comments/1plhhu1/i_have_some_data_on_how_players_feel_about_ai/,I have some data on how players feel about AI generated arts.,,en,developer,neutral,art,,h1+h2,,True,neutral,visible_ai
18053,22,https://www.reddit.com/r/gamedev/comments/1pl8wgb/long_time_gamer_first_time_designer_conflicted/,"Long time gamer, first time designer. Conflicted about using AI for art.",,en,outsider,question,art,,h1+h2,,True,neutral,visible_ai
18054,22,https://www.reddit.com/r/gamedev/comments/1mzb8md/is_ai_art_frowned_upon_in_game_development/,Is AI art frowned upon in game development?,,en,developer,question,art,,h1+h2,,True,neutral,visible_ai
22437,22,https://www.reddit.com/r/gamedev/comments/1fa8mkq/i_have_a_question_regarding_something_that_may/,I have a question regarding something that may not be feasible with our current technology (yet),,en,player,positive,art,,h2,,True,positive,visible_ai
18068,22,https://www.reddit.com/r/gamedev/comments/1pd294d/where_i_personally_stand_with_ai_in_game/,Where I personally stand with AI in game development,,en,developer,neutral,art,voluntary,h2+h3,,True,neutral,visible_ai
18071,22,https://www.reddit.com/r/gamedev/comments/1rgtwkw/3d_artist_considering_transition_to_tech_art_to/,3D artist considering transition to Tech Art to future proof against AI,,en,developer,question,art,,h1,,True,neutral,visible_ai
18074,22,https://www.reddit.com/r/gamedev/comments/194psap/i_genuinely_do_not_understand_all_of_the_hate_and/,I genuinely do not understand all of the hate and prohibition of AI Art,,en,developer,positive,art,,h1+h2,,True,positive,visible_ai
18083,22,https://www.reddit.com/r/gaming/comments/1rz4y1d/crimson_desert_has_already_been_caught_using_ai/,Crimson Desert has already been caught using AI art,,en,player,negative,art,discovered,h2+h3,,True,negative,visible_ai
18089,22,https://www.reddit.com/r/gaming/comments/1tj62gc/ai_is_making_me_want_to_stop_buying_games/,AI is Making Me Want to Stop Buying Games Completely,,en,player,negative,general,,h1+h2,,True,negative,general_discussion
18099,22,https://www.reddit.com/r/gaming/comments/1ad1fz6/are_you_against_all_ai_in_game_development/,Are you against all AI in game development?,,en,player,question,general,,h2,,True,neutral,general_discussion
18100,22,https://www.reddit.com/r/gaming/comments/19culs1/if_palworld_used_ai_to_generate_its_art_doesnt/,"If Palworld used AI to generate it's art, doesn't that mean that the art has no copyright protections?",,en,player,negative,art,,h3,,True,negative,visible_ai
18103,22,https://www.reddit.com/r/gaming/comments/17njyz6/if_you_see_ai_arts_in_the_video_game_you_play/,"If you see AI Arts in the video game you play, will that turn you off?",,en,player,question,art,,h1+h2,,True,neutral,visible_ai
18107,22,https://www.reddit.com/r/gaming/comments/1dgmjhw/the_potential_impact_of_ai_on_gaming/,The potential impact of AI on gaming,,en,player,positive,voice,,h2,,True,positive,visible_ai
18112,22,https://www.reddit.com/r/gaming/comments/16vypjg/with_advances_in_ai_image_generation_how_will_we/,"With advances in AI image generation, how will we authenticate lost gaming history?",,en,player,question,art,,h3,,True,neutral,visible_ai
18115,22,https://www.reddit.com/r/gaming/comments/1rz97vf/am_i_the_only_one_who_still_thinks_crimson_desert/,Am I the only one who still thinks Crimson Desert is GOTY material?,,en,player,neutral,art,discovered,h2+h3,,True,neutral,visible_ai
18118,22,https://www.reddit.com/r/gaming/comments/wln63q/how_will_ai_change_gaming_in_this_decade/,How will AI change gaming in this decade?,,en,player,positive,general,,h1+h2,,True,positive,general_discussion
18123,22,https://www.reddit.com/r/gaming/comments/zkl2g2/thoughts_on_the_future_of_ai_for_games/,Thoughts on the future of AI for games?,,en,player,question,general,,h1+h2,,True,neutral,general_discussion
18125,22,https://www.reddit.com/r/gaming/comments/xzdtdb/ai_use_in_games_what_could_or_should_we_see_in/,AI use in games - what could (or should) we see in future?,,en,player,neutral,voice,,h2,,True,neutral,visible_ai
18140,22,https://www.reddit.com/r/gaming/comments/1dh0ezu/as_gamers_were_exicted_about_ai_right/,"As gamers, we're exicted about AI, right?",,en,player,positive,voice,,h2,,True,positive,visible_ai
18151,22,https://www.reddit.com/r/gaming/comments/1jb7tlj/what_if_cyberpunk_2077_had_ai_artwork_in_it/,What if Cyberpunk 2077 had AI artwork in it?,,en,player,positive,art,,h2,,True,positive,visible_ai
18157,22,https://www.reddit.com/r/Games/comments/1lks0lj/according_to_its_steam_store_page_the_announced/,"According to its Steam store page, the announced upcoming game Everybody's Golf: Hot Shots uses AI generated textures",,en,player,neutral,art,voluntary,h2+h3,,True,neutral,visible_ai
18164,22,https://www.reddit.com/r/Games/comments/1soofll/changing_perspective_on_ai_characters_in_video/,Changing perspective on AI characters in video games and in stories in general.,,en,player,neutral,gameplay,,h2,,True,neutral,visible_ai
22501,22,https://www.reddit.com/r/IndieGaming/comments/1qn0zkk/i_built_a_system_that_turns_text_prompts_into/,I built a system that turns text prompts into playable 3D characters. Here's a beckoning cat in green alpaca suit vs a beer-bending pink elephant,,en,developer,positive,art,,h2,,True,positive,visible_ai
18218,22,https://www.reddit.com/r/pcgaming/comments/1n2ma27/would_you_stop_playing_a_game_if_you_found_out_it/,Would you stop playing a game if you found out it used AI?,,en,player,question,general,,h1+h2,,True,neutral,general_discussion
18221,22,https://www.reddit.com/r/pcgaming/comments/1mx8fym/would_you_ever_play_a_game_that_uses_ai_where/,Would you ever play a game that uses AI? Where would you draw the line?,,en,player,question,general,,h1+h2,,True,neutral,general_discussion
18258,22,https://www.reddit.com/r/Steam/comments/1r8jhyo/disney_speedstorm_uses_ai_art_and_does_not/,"Disney Speedstorm uses AI art, and does not disclose it on Steam?",,en,player,negative,art,discovered,h2+h3,,True,negative,visible_ai
18259,22,https://www.reddit.com/r/Steam/comments/1h8d6e7/call_of_duty_black_ops_6_challenges_steams_stance/,"Call of Duty: Black Ops 6 challenges Steam’s stance against undisclosed AI art, and Steam won’t do anything about it",,en,player,negative,art,discovered,h2+h3,,True,negative,visible_ai
18263,22,https://www.reddit.com/r/Steam/comments/1ml9bfq/any_way_to_block_seeing_games_that_use_generative/,Any way to block seeing games that use Generative AI?,,en,player,negative,art,,h3,,True,negative,visible_ai
18265,22,https://www.reddit.com/r/Steam/comments/1k2cb9l/steam_should_add_this_but_for_ai/,Steam should add this but for AI,,en,player,negative,art,,h3,,True,negative,visible_ai
18272,22,https://www.reddit.com/r/Steam/comments/14x1nih/ideas_on_how_to_make_an_aigenerated_game/,Ideas on how to make an AI-generated game compliant with Steam's copyright policies?,,en,developer,question,art,,h3,,True,neutral,visible_ai
18273,22,https://www.reddit.com/r/Steam/comments/1c92kxc/ai_art_curator/,Ai Art Curator,,en,player,negative,art,,h3,,True,negative,visible_ai
18274,22,https://www.reddit.com/r/Steam/comments/1aubivx/is_it_ok_to_update_your_game_using_pregenerated/,Is it OK to update your game using pre-generated AI content?,,en,player,negative,art,,h3,,True,negative,visible_ai
18289,22,https://www.reddit.com/r/Steam/comments/1eg6lyg/exclude_tag_addition/,Exclude Tag Addition?,,en,player,negative,art,,h3,,True,negative,visible_ai
18295,22,https://www.reddit.com/r/IndieGaming/comments/1om06j8/ai_art_trained_on_my_own_art/,AI Art Trained On My OWN Art?,,en,developer,question,art,voluntary,h2+h3,,True,neutral,visible_ai
18297,22,https://www.reddit.com/r/IndieGaming/comments/1kr40sn/the_duality_of_capsule_feedback_posts/,The Duality of Capsule Feedback Posts,,en,developer,neutral,art,,h2+h3,,True,neutral,visible_ai
18298,22,https://www.reddit.com/r/IndieGaming/comments/1so6t1e/100_handdrawn_but_we_still_get_hit_with_the_ai/,"100% hand-drawn, but we still get hit with the AI allegations. 🤦‍♂️ Question: Is AI a deciding factor for you when picking up a new game?",,en,developer,negative,art,,h2+h3,,True,negative,visible_ai
18306,22,https://www.reddit.com/r/IndieGaming/comments/1t42q90/a_rant_on_why_you_as_a_developer_can_and_should/,"A rant on why you, as a developer, can and should get rid of Generative AI entirely",,en,developer,negative,art,,h1+h2,,True,negative,visible_ai
22539,22,https://www.reddit.com/r/PS5/comments/1pocglm/larian_ceo_responds_to_divinity_gen_ai_backlash/,"Larian CEO Responds to Divinity Gen AI Backlash: 'We Are Neither Releasing a Game With Any AI Components, Nor Are We Looking at Trimming Down Teams to Replace Them With AI' - IGN",,en,developer,neutral,art,voluntary,h1+h3,,True,neutral,visible_ai
22540,22,https://www.reddit.com/r/SubredditDrama/comments/1p9a6eu/never_saw_a_more_clueless_person_be_so_arrogant/,"""never saw a more clueless person be so arrogant to think they are right just because other dont agree with thzir shity take lmao"" AI bros in r/Steam get testy over Steam's policy of requiring game companies to disclose when they used AI to make their game",,en,player,neutral,general,,h3,,True,neutral,general_discussion
22541,22,https://www.reddit.com/r/gachagaming/comments/1t67o7a/everyones_losing_their_minds_over_ai_in_the_new/,"Everyone's losing their minds over AI in the new game and honestly, y'all need to chill",,en,player,positive,art,,h1+h2,,True,positive,visible_ai
22542,22,https://www.reddit.com/r/PlayStation_X/comments/1rn74ek/leon_kennedys_voice_actor_doesnt_believe_ai_can/,"Leon Kennedy's voice actor doesn't believe AI can replace human performances, and paying 'for an actor's voice session is not that big of a deal' for games as big as Arc Raiders",,en,developer,negative,voice,discovered,h1+h2,,True,negative,visible_ai
22543,22,https://www.reddit.com/r/aiwars/comments/1tee8f1/why_coders_and_artists_react_so_differently_to/,Why coders and artists react so differently to the prospect of being replaced by AI,,en,player,neutral,art,,h1,,True,neutral,visible_ai
22544,22,https://www.reddit.com/r/SubredditDrama/comments/1122rld/the_artist_vs_ai_saga_continues_rmorrowind/,"The ""Artist vs AI"" saga continues: r/Morrowind discusses after prominent voice actor speaks out against AI-generated voices",,en,player,neutral,voice,,h1+h2,,True,neutral,visible_ai
18340,22,https://www.reddit.com/r/IndieGaming/comments/1kjfuf7/real_question_regarding_ai_implementation_into/,Real Question regarding AI implementation into Indie Game : Does it affect your Perception of the game ?,,en,developer,question,art,voluntary,h1+h2,,True,neutral,visible_ai
22545,22,https://www.reddit.com/r/PcParadise/comments/1s2qr14/capcom_says_no_to_ai_in_games_only_using_it_for/,Capcom says NO to AI in games only using it for dev ideas,,en,developer,neutral,art,,h1+h3,,True,neutral,visible_ai
22546,22,https://www.reddit.com/r/otomegames/comments/1lvlfq0/we_replaced_all_the_ai_backgrounds_in_mystic_café/,"We replaced all the AI backgrounds in Mystic Café Romance with real ones, and to celebrate, the game is 50% OFF!",,en,developer,negative,art,voluntary,h2+h3,,True,negative,visible_ai
22547,22,https://www.reddit.com/r/aigamedev/comments/1qsboh1/honest_discussion_using_aigenerated_art_in_indie/,Honest Discussion: Using AI-Generated Art in Indie Game Dev. Why Do Some People See It as Taboo?,,en,developer,question,art,,h1+h2,,True,neutral,visible_ai
22548,22,https://www.reddit.com/r/ItsAllAboutGames/comments/1t7ao44/sony_openly_declares_its_intent_to_use_ai_in_game/,Sony openly declares its intent to use AI in game development!,,en,developer,neutral,art,,h1,,True,neutral,visible_ai
18351,22,https://www.reddit.com/r/IndieGaming/comments/1shvncz/weve_spent_hundreds_of_hours_already_instead_of/,We've spent hundreds of hours already instead of AI - Is it worth it?,,en,developer,negative,art,,h1+h2,,True,negative,visible_ai
18352,22,https://www.reddit.com/r/IndieGaming/comments/1rum1jt/sandbox_genre_has_been_ruined_by_rampant_ai_slop/,Sandbox Genre has been ruined by rampant AI slop,,en,player,negative,art,,h1+h2,,True,negative,visible_ai
18361,22,https://www.reddit.com/r/IndieGaming/comments/15a52mp/examples_of_copyrightlawcompliant_ai_generated/,"Examples of copyright-law-compliant, AI generated art assets in Steam games?",,en,developer,question,art,,h3,,True,neutral,visible_ai
22551,22,https://www.reddit.com/r/aiwars/comments/1rih7pz/im_a_small_studio_indie_game_dev_i_need_help_on/,"I'm a small studio indie game dev. I need help on how to handle questions about AI, because sometimes it feels like a witch hunt right now...",,en,developer,question,art,voluntary,h1+h3,,True,neutral,visible_ai
22553,22,https://www.reddit.com/r/boardgames/comments/1s1ym0r/small_indie_studio_bringing_first_game_to/,"Small indie studio bringing first game to Gamefound. We used some AI art due to low budget, and after the Concordia backlash, we are terrified. Need your honest advice.",,en,developer,question,art,voluntary,h1+h2+h3,,True,neutral,visible_ai
18364,22,https://www.reddit.com/r/GameDevelopment/comments/1lva5wg/our_take_on_the_question_will_using_ai_in_indie/,Our take on the question: Will using AI in indie games hurt sales or reviews?,,en,developer,neutral,art,,h1+h2,,True,neutral,visible_ai
18365,22,https://www.reddit.com/r/GameDevelopment/comments/1afp2jg/how_do_users_feel_about_ai_artdialogue/,How do users feel about ai art/dialogue?,,en,developer,question,art,,h1+h2,,True,neutral,visible_ai
18366,22,https://www.reddit.com/r/GameDevelopment/comments/1qbd306/using_ai_to_develop_a_tool_that_you_then_use_to/,Using AI to develop a tool that you then use to help you develop your game.,,en,developer,neutral,tools,,h3,,True,neutral,internal_tools
22554,22,https://www.reddit.com/r/FuckTAA/comments/1rvl6oe/bye_bye_taa_hello_ai_slop/,Bye bye TAA... Hello AI Slop,,en,player,negative,art,,h2,,True,negative,visible_ai
22555,22,https://www.reddit.com/r/SubredditDrama/comments/1csd0p7/rgames_discusses_the_ethics_of_generative_ai/,r/Games discusses the ethics of generative AI,,en,player,neutral,voice,voluntary,h1+h2,,True,neutral,visible_ai
18409,22,https://www.reddit.com/r/GameDevelopment/comments/1p46iix/how_ethical_is_it_to_use_ai_and_how_far_is_too_far/,How ethical is it to use AI and how far is TOO FAR?,,en,outsider,question,tools,voluntary,h1+h3,,True,neutral,internal_tools
22565,22,https://www.reddit.com/r/aiwars/comments/1sx4mgj/what_are_your_thoughts_on_ai_being_used_in_video/,What are your thoughts on AI being used in video games?,,en,player,neutral,general,,h2,,True,neutral,general_discussion
22566,22,https://www.reddit.com/r/blackops6/comments/1h928xn/ai_protest/,AI Protest,,en,player,negative,art,discovered,h1+h2+h3,,True,negative,visible_ai
22568,22,https://www.reddit.com/r/ItsAllAboutGames/comments/1rhhgr2/the_integration_of_ai_into_games_is_frustrating/,"The integration of AI into games is frustrating gamers, while developers seek ways to cut costs.",,en,player,negative,voice,,h1+h2,,True,negative,visible_ai
18430,22,https://www.reddit.com/r/gamedev/comments/195n0n7/who_here_would_not_buy_a_game_if_it_used_ai_for/,Who here would NOT buy a game if it used AI for voice acting?,,en,developer,question,voice,voluntary,h1+h2,,True,neutral,visible_ai
18431,22,https://www.reddit.com/r/gamedev/comments/18iziba/the_finals_game_apparently_has_ai_voice_acting/,The Finals game apparently has AI voice acting and Valve seems fine with it.,,en,player,negative,voice,,h3,,True,negative,visible_ai
18433,22,https://www.reddit.com/r/gamedev/comments/1p0eqeu/ab_test_dev_voice_acting_vs_ai_voice_which_works/,A/B Test: Dev voice acting vs AI voice. Which works better for my game?,,en,developer,neutral,voice,voluntary,h2,,True,neutral,visible_ai
