article_id,source_id,url,title_hint,post_date,language,author_role,ai_stance,ai_type,disclosure_type,hypothesis_type,query_cluster,relevant_flag,post_stance_3,ai_visibility_group
20227,22,https://www.reddit.com/r/gamedev/comments/1pwd1l8/hear_me_out_ai_is_a_net_good_for_this_industry/,Hear Me Out: AI Is A Net Good For This Industry,,en,developer,positive,general,,h1+h2,,True,positive,general_discussion
20298,22,https://www.reddit.com/r/pcgaming/comments/1pttmaq/i_offer_you_to_play_breadwalk_a_free_30_minute/,"I offer you to play Breadwalk - a free, 30 minute story-driven game, where a war is ongoing, but you need to buy bread.",,en,developer,neutral,art,voluntary,h2+h3,,True,neutral,visible_ai
20462,22,https://www.reddit.com/r/gamedev/comments/1ii499e/is_aienabled_coding_even_worth_it/,Is AI-enabled 'coding' even worth it?,,en,developer,neutral,tools,,h1+h2,,True,neutral,internal_tools
20463,22,https://www.reddit.com/r/gamedev/comments/1at98m5/is_indie_gamedev_a_safe_spot_for_the_ai_job/,"Is indie gamedev a ""safe spot"" for the AI job revolution?",,en,developer,neutral,general,,h1+h2,,True,neutral,general_discussion
19736,22,https://www.reddit.com/r/pcgaming/comments/143ueww/myst_creators_latest_game_used_ai_assisted/,"Myst creator's latest game used 'AI assisted content,' and funders are pissed",,en,player,negative,art,discovered,h2+h3,,True,negative,visible_ai
19737,22,https://www.reddit.com/r/pcgaming/comments/1cwlrwr/microsofts_ai_will_be_inside_minecraft_and_other/,"Microsoft's AI will be inside Minecraft, and other Xbox, PC games: new Copilot features will search your inventories, offer tips and guides",,en,player,neutral,voice,,h2,,True,neutral,visible_ai
21197,22,https://www.reddit.com/r/gamedev/comments/1p0iv52/results_after_1_week_since_publishing_the_game_6k/,Results after 1 week since publishing the game. $6k gross revenue with 12k wishlists on launch.,,en,developer,neutral,art,discovered,h1+h2+h3,,True,neutral,visible_ai
21425,22,https://www.reddit.com/r/gamedev/comments/1lko7r9/how_do_you_think_ai_will_affect_the_future_of/,How do you think AI will affect the future of game development?,,en,developer,neutral,general,,h1+h2,,True,neutral,general_discussion
21797,22,https://www.reddit.com/r/gaming/comments/1mui28e/they_stole_my_face_streamer_claims_the_first/,‘They stole my face’: Streamer claims The First Descendant ads used AI to make it look like he’s promoting it,,en,player,negative,art,discovered,h1+h3,,True,negative,visible_ai
21874,22,https://www.reddit.com/r/gaming/comments/13nfvf9/with_advanced_language_models_like_chatgpt_being/,"With advanced language models like ChatGPT being so mainstream now, do you think we'll finally see actually advanced AI in gaming?",,en,player,positive,gameplay,,h2,,True,positive,visible_ai
21875,22,https://www.reddit.com/r/gaming/comments/q607tm/ai_in_games/,AI in games,,en,player,positive,gameplay,,h2,,True,positive,visible_ai
22037,22,https://www.reddit.com/r/GameDevelopment/comments/1m0xb5y/curious_about_the_llms_in_games_situation/,Curious about the LLMs in games situation.,,en,developer,neutral,gameplay,,h2,,True,neutral,visible_ai
22065,22,https://www.reddit.com/r/gamedev/comments/1k8wi5t/is_it_even_possible_to_make_a_good_game_with/,Is it even possible to make a good game with AI-driven NPCs?,,en,developer,neutral,gameplay,,h2,,True,neutral,visible_ai
22053,22,https://www.reddit.com/r/gamedev/comments/1n93pon/were_making_the_move_to_become_a_generative/,We're making the move to become a generative AI-free marketplace,,en,developer,negative,art,,h1+h3,,True,negative,visible_ai
22055,22,https://www.reddit.com/r/gamedev/comments/1rp9722/whats_the_heck_with_this_aigenerated_content/,What's the heck with this AI-generated content?,,en,developer,neutral,art,,h1+h2,,True,neutral,visible_ai
16934,22,https://www.reddit.com/r/gamedev/comments/1rpeeta/i_analyzed_3_years_of_gdc_reports_on_generative/,"I analyzed 3 years of GDC reports on generative AI in game dev. Developers hate it more every year, but the ones using it all use it for the same thing.",2026-03-10 01:06:54.000,en,developer,neutral,general,,h1+h2,,True,neutral,general_discussion
16935,22,https://www.reddit.com/r/gamedev/comments/16bcj4a/first_indie_game_on_steam_failed_on_build_review/,First indie game on Steam failed on build review for AI assets - even though we have no AI assets. All assets were hand drawn/sculpted by our artists,2023-09-06 09:19:47.000,en,developer,negative,art,,h3,,True,negative,visible_ai
16937,22,https://www.reddit.com/r/gamedev/comments/1reqzg8/thoughts_on_ai_in_games/,Thoughts on AI in Games,2026-02-26 00:47:02.000,en,developer,neutral,general,,h1+h2,,True,neutral,general_discussion
16938,22,https://www.reddit.com/r/gamedev/comments/1gdzqdb/do_you_fear_being_replaced_by_generative_ai/,Do you fear being replaced by generative AI?,2024-10-28 14:31:09.000,en,outsider,negative,general,,h1,,True,negative,general_discussion
16940,22,https://www.reddit.com/r/gamedev/comments/1sywnbl/reconciling_proai_and_antiai_sentiment_in_game/,Reconciling pro-AI and anti-AI sentiment in game development,2026-04-29 14:57:14.000,en,developer,negative,tools,,h1,,True,negative,internal_tools
16941,22,https://www.reddit.com/r/gamedev/comments/x05ipc/ethics_of_using_ai_art_in_games/,Ethics of using AI Art in Games?,2022-08-28 23:41:31.000,en,developer,question,art,,h1+h2,,True,neutral,visible_ai
16942,22,https://www.reddit.com/r/gamedev/comments/1mff3ae/question_about_ai_in_game_development/,Question about ai in game development - specifically coding,2025-08-02 05:20:32.000,en,outsider,question,tools,,h1,,True,neutral,internal_tools
16943,22,https://www.reddit.com/r/gamedev/comments/1asjc4f/thoughts_on_future_games_using_generative_ai_to/,Thoughts on future games using Generative AI to procedurally generate all content?,2024-02-16 23:55:04.000,en,outsider,positive,gameplay,,h2,,True,positive,visible_ai
16947,22,https://www.reddit.com/r/gamedev/comments/1jczvho/tools_and_legit_use_cases_for_ai_in_game_dev/,Tools and legit use cases for AI in game dev,2025-03-17 03:16:30.000,en,developer,positive,art,,h1+h2,,True,positive,visible_ai
16948,22,https://www.reddit.com/r/gamedev/comments/12lrgw7/what_kind_of_job_in_game_production_can_i_take/,What kind of job in game production can I take before the AI takes over?,2023-04-14 12:42:40.000,en,outsider,negative,art,,h1+h2,,True,negative,visible_ai
16951,22,https://www.reddit.com/r/gamedev/comments/1n7psp3/is_game_development_gradually_becoming_more/,Is game development gradually becoming more accessible for non-programmers?,2025-09-03 23:20:45.000,en,developer,neutral,tools,,h1,,True,neutral,internal_tools
16950,22,https://www.reddit.com/r/gamedev/comments/1rxm1cv/i_worked_an_ai_booth_at_gdc_heres_what_developers/,I Worked an AI Booth at GDC. Here’s What Developers Actually Said,2026-03-19 03:50:40.000,en,developer,neutral,general,,h1+h2,,True,neutral,general_discussion
16952,22,https://www.reddit.com/r/gamedev/comments/1mq9x1l/do_you_view_ai_programming_from_ai_generated_art/,Do you view AI programming from AI generated art?,2025-08-14 22:05:19.000,en,developer,negative,general,,h2+h3,,True,negative,general_discussion
16955,22,https://www.reddit.com/r/gamedev/comments/1stnsf6/the_rise_of_ai_has_been_putting_an_unbelievable/,The rise of AI has been putting an unbelievable amount of pressure,2026-04-23 19:30:53.000,en,developer,negative,tools,,h1,,True,negative,internal_tools
22058,22,https://www.reddit.com/r/gamedev/comments/1k3qewn/will_a_game_sell_worse_or_be_looked_down_upon_if/,Will a game sell worse or be looked down upon if the developer only uses AI tools like Copilot in VSCode?,,en,developer,question,tools,voluntary,h1+h3,,True,neutral,internal_tools
16957,22,https://www.reddit.com/r/gamedev/comments/1pgbbih/stuck_with_art/,Stuck with art,2025-12-07 09:20:13.000,en,developer,positive,art,voluntary,h2+h3,,True,positive,visible_ai
16958,22,https://www.reddit.com/r/gamedev/comments/1qhwy37/what_is_the_best_ai_to_generate_pixel_sprite/,What is the best AI to generate pixel sprite characters?,2026-01-20 12:50:12.000,en,outsider,positive,art,,h1+h2,,True,positive,visible_ai
16959,22,https://www.reddit.com/r/gamedev/comments/16eqg5m/whats_this_issue_with_new_technologies_further/,What's this issue with new technologies further streamlining game development?,2023-09-10 07:16:25.000,en,outsider,positive,general,,h1,,True,positive,general_discussion
16961,22,https://www.reddit.com/r/gamedev/comments/1je6lzn/generative_ai_and_its_impact_on_publishers_studios/,Generative AI and Its Impact on Publishers &amp; Studios,2025-03-18 17:44:17.000,en,developer,negative,general,,h1+h2,,True,negative,general_discussion
16962,22,https://www.reddit.com/r/gamedev/comments/1l902q7/ai_help_or_threat_where_do_you_draw_the_line/,AI - help or threat? Where do you draw the line?,2025-06-11 21:22:14.000,en,outsider,neutral,tools,,h1+h2,,True,neutral,internal_tools
16965,22,https://www.reddit.com/r/gamedev/comments/1oj954u/jevons_paradox_and_the_usage_of_ai_in_gamedev/,Jevons paradox and the usage of AI in gamedev,2025-10-29 19:26:31.000,en,developer,positive,tools,,h1,,True,positive,internal_tools
16972,22,https://www.reddit.com/r/gamedev/comments/11r0w1s/what_are_your_thoughts_on_using_aigenerated_art/,What are your thoughts on using AI-generated art in lieu of paid assets due to budgetary constraints?,2023-03-14 11:42:24.000,en,developer,question,art,,h2,,True,neutral,visible_ai
16974,22,https://www.reddit.com/r/gamedev/comments/1jb3lqd/i_am_genuinely_concerned_about_the_future_of_the/,I am genuinely concerned about the future of the video game industry,2025-03-14 16:13:34.000,en,outsider,negative,general,,h1+h2,,True,negative,general_discussion
16971,22,https://www.reddit.com/r/gamedev/comments/1l9m6t0/bored_of_the_ai_fearmongering/,bored of the AI fearmongering,2025-06-12 16:15:15.000,en,developer,negative,general,,h1+h2,,True,negative,general_discussion
16977,22,https://www.reddit.com/r/gamedev/comments/1hri442/goodbye_gaming_industry/,Goodbye Gaming industry,2025-01-02 04:26:11.000,en,developer,negative,general,,h1,,True,negative,general_discussion
16976,22,https://www.reddit.com/r/gamedev/comments/1kxjpph/a_necessary_rant_about_ai_the_dark_future_of_art/,"A ''NECESSARY'' rant about AI, the DARK FUTURE of art and the soul of creation!",2025-05-28 18:15:59.000,en,developer,negative,general,,h1,,True,negative,general_discussion
16981,22,https://www.reddit.com/r/gamedev/comments/1jx0zi1/gamedevjs_gamejam_endorsing_ai_art/,Gamedev.js gamejam endorsing AI art,2025-04-12 00:21:47.000,en,developer,negative,art,,h1+h2,,True,negative,visible_ai
16983,22,https://www.reddit.com/r/gamedev/comments/1bp9k3k/opinions_on_using_ai_in_gamedev/,Opinions on using AI in gamedev?,2024-03-27 21:46:52.000,en,developer,question,art,,h1+h2+h3,,True,neutral,visible_ai
22071,22,https://www.reddit.com/r/gamedev/comments/1i8r2jw/lacs_labeling_of_ai_generated_assets/,LACS labeling of AI generated assets,,en,developer,neutral,art,,h3,,True,neutral,visible_ai
16987,22,https://www.reddit.com/r/gamedev/comments/1cb4zel/good_sites_to_hire_musicians/,Good sites to hire musicians,2024-04-23 16:43:03.000,en,developer,neutral,voice,,h2+h3,,True,neutral,visible_ai
16988,22,https://www.reddit.com/r/gamedev/comments/193c2a1/make_better_key_art_with_a_great_marketing_brief/,Make better Key Art with a great marketing brief. 7 steps to create a brief from a marketing professional.,2024-01-10 19:19:31.000,en,developer,negative,art,,h1+h2,,True,negative,visible_ai
16990,22,https://www.reddit.com/r/gamedev/comments/1poql3y/the_artist_i_hired_is_probably_using_ai/,The artist I hired is probably using AI,2025-12-17 10:34:30.000,en,developer,negative,art,,h2+h3,,True,negative,visible_ai
16991,22,https://www.reddit.com/r/gamedev/comments/1nlxbua/why_are_people_so_convinced_ai_will_be_making/,"Why are people so convinced AI will be making games anytime soon? Personally, I call bullshit.",2025-09-20 15:49:13.000,en,developer,negative,general,,h1,,True,negative,general_discussion
16993,22,https://www.reddit.com/r/gamedev/comments/1m5qm0d/ai_isnt_replacing_game_devs_execs_are/,"AI isnt replacing Game Devs, Execs are",2025-07-21 21:20:06.000,en,unclear,neutral,general,,h1,,True,neutral,general_discussion
22086,22,https://www.reddit.com/r/gaming/comments/1owxnoi/call_of_duty_black_ops_7_is_littered_with_ai_art/,"Call of Duty: Black Ops 7 is littered with AI art slop, because your $70 means nothing anymore",,en,player,negative,art,discovered,h1+h2+h3,,True,negative,visible_ai
16995,22,https://www.reddit.com/r/gamedev/comments/x00s3h/so_i_think_its_a_complete_myth_that_ai_cant/,"So, I think it's a complete myth that AI can't generate assets for an entire game with a consistent style.",2022-08-28 20:21:16.000,en,developer,positive,art,voluntary,h2,,True,positive,visible_ai
16999,22,https://www.reddit.com/r/gamedev/comments/1qmddnp/artist_teammate_used_ai_for_our_assets/,"""artist"" teammate used ai for our assets",2026-01-25 11:11:52.000,en,outsider,negative,art,discovered,h2+h3,,True,negative,visible_ai
17000,22,https://www.reddit.com/r/gamedev/comments/16r4dik/steam_also_rejects_games_translated_by_ai_details/,"Steam also rejects games translated by AI, details are in the comments",2023-09-24 21:07:09.000,en,developer,negative,general,voluntary,h3,,True,negative,general_discussion
17001,22,https://www.reddit.com/r/gamedev/comments/1t3y946/fiverr_artist_used_ai_art/,Fiverr artist used AI art,2026-05-05 02:22:58.000,en,developer,negative,art,discovered,h3,,True,negative,visible_ai
17003,22,https://www.reddit.com/r/gamedev/comments/1lytmj7/is_there_a_way_to_check_if_outsource_artist_uses/,Is there a way to check if outsource artist uses AI?,2025-07-13 17:05:16.000,en,developer,question,art,,h3,,True,neutral,visible_ai
17004,22,https://www.reddit.com/r/gamedev/comments/1kmoptk/if_i_hire_an_artist_how_do_i_know_he_is_not_just/,"If I hire an artist, how do I know he is not just using ai?",2025-05-14 22:52:02.000,en,developer,question,art,,h3,,True,neutral,visible_ai
17011,22,https://www.reddit.com/r/gamedev/comments/1ryyvjk/i_just_spent_3_months_of_my_life_building_this_is/,"I just spent 3 months of my life building this. Is it ""AI Slop"" or is it my indie game? Where do we draw the line?",,en,outsider,question,tools,,h1,,True,neutral,internal_tools
17012,22,https://www.reddit.com/r/gamedev/comments/1t7ynju/i_replaced_myself_with_ai_when_it_comes_to/,I replaced myself with AI when it comes to programming. I don't even read the code anymore. I'm just a tester at this point...,,en,developer,positive,tools,,h1,,True,positive,internal_tools
17005,22,https://www.reddit.com/r/gamedev/comments/1t8chdq/forced_to_use_ai_for_pixel_art_no_budget_cant/,"Forced to use AI for pixel art (no budget, can't draw it myself) — would that kill the game for you?",2026-05-09 21:14:42.000,en,developer,question,art,voluntary,h2+h3,,True,neutral,visible_ai
17006,22,https://www.reddit.com/r/gamedev/comments/1syywes/tired_of_ai_witch_hunt_going_on_in_all_game_dev/,Tired of AI witch hunt going on in all game dev communities,2026-04-29 16:30:49.000,en,developer,neutral,art,,h2+h3,,True,neutral,visible_ai
17013,22,https://www.reddit.com/r/gamedev/comments/1nnjy9x/using_ai_for_game_assets_whats_ok_or_and_whats_not/,"Using AI for game assets, what's ""OK"" or and what's not?",,en,developer,question,art,,h2+h3,,True,neutral,visible_ai
17014,22,https://www.reddit.com/r/gamedev/comments/1rc8uhx/game_developers_arent_going_to_be_replaced_by_ai/,"Game developers aren’t going to be replaced by AI anytime soon. But if you genuinely believe AI won’t fundamentally change how we make games, you’re kidding yourself.",,en,developer,neutral,general,,h1,,True,neutral,general_discussion
22089,22,https://www.reddit.com/r/gaming/comments/1e190to/how_far_are_we_from_ai_generated_dialogue/,How far are we from AI generated dialogue? ,,en,player,positive,gameplay,,h2,,True,positive,visible_ai
22090,22,https://www.reddit.com/r/gaming/comments/1bq1jgt/will_you_enjoy_a_game_which_is_combination_of_ai/,Will you enjoy a game which is combination of AI generated dialogues + RPG?,,en,player,positive,gameplay,,h2,,True,positive,visible_ai
22091,22,https://www.reddit.com/r/gaming/comments/1hp0afi/why_are_there_so_many_ai_slop_games_on_psn/,Why are there so many AI slop games on PSN?,,en,player,negative,art,,h3,,True,negative,visible_ai
22093,22,https://www.reddit.com/r/gaming/comments/1dcl90j/how_would_you_like_gamedevs_to_use_ai_in_their/,How would you like gamedevs to use AI in their Games?,,en,player,positive,gameplay,,h2,,True,positive,visible_ai
22094,22,https://www.reddit.com/r/gaming/comments/1frzzah/where_are_my_ai_upscaled_90s_point_and_click/,Where are my AI upscaled 90s point and click games at?,,en,player,positive,art,,h2,,True,positive,visible_ai
22095,22,https://www.reddit.com/r/gaming/comments/11gxjmg/i_wonder_when_ai_generators_be_incorporated_in/,I wonder when AI generators be incorporated in videogames to finally give us true unique experiences,,en,player,positive,general,,h2,,True,positive,general_discussion
17007,22,https://www.reddit.com/r/gamedev/comments/1mf2kg4/took_your_advice_and_hired_a_digital_artist_for/,Took your advice and hired a digital artist for my Steam capsule. I will no longer be using AI-generated artwork.,,en,developer,neutral,art,voluntary,h2+h3,,True,neutral,visible_ai
17008,22,https://www.reddit.com/r/gamedev/comments/1qhx52t/how_to_get_art_for_your_game_that_isnt_ai/,How To Get Art For Your Game That Isn't AI,,en,developer,negative,art,,h3,,True,negative,visible_ai
17009,22,https://www.reddit.com/r/gamedev/comments/1r9vmkk/short_guide_develop_games_without_artistic_skills/,Short Guide: Develop games without artistic skills and without AI,,en,developer,negative,art,,h2,,True,negative,visible_ai
17010,22,https://www.reddit.com/r/gamedev/comments/1r9qk4y/artstation_feels_dead_for_discovery_where_are/,Artstation feels dead for discovery. Where are game artists getting noticed now?,,en,developer,negative,art,,h1+h2,,True,negative,visible_ai
20690,22,https://www.reddit.com/r/gamedev/comments/18jtn6s/im_trying_to_make_games_with_real_ai_what_else/,I’m trying to make games with real AI. What else can be done?,,en,developer,positive,gameplay,,h2,,True,positive,visible_ai
20695,22,https://www.reddit.com/r/gamedev/comments/1965ffi/thoughts_on_the_industry_for_all_its_flaws_ai_art/,"Thoughts on the industry: for all its flaws, AI art will still enable many great ""creative"" non-AAA games",,en,developer,neutral,art,,h1+h2,,True,neutral,visible_ai
20696,22,https://www.reddit.com/r/gamedev/comments/16b7wnt/never_programmed_before_and_tried_what_i_can_do/,"Never programmed before and tried, what I can do with Visual Studio and GPT - Made a game in ONE freaking day...",,en,developer,positive,art,,h1,,True,positive,visible_ai
22097,22,https://www.reddit.com/r/gaming/comments/1367llc/are_any_games_experimenting_with_aillm_dialogue/,Are any games experimenting with AI/LLM dialogue for NPCs?,,en,player,positive,gameplay,,h2,,True,positive,visible_ai
22099,22,https://www.reddit.com/r/gaming/comments/128qybu/how_ai_like_openai_will_help_gaming_in_general/,How AI like OpenAI will help gaming in general ?,,en,player,positive,gameplay,,h2,,True,positive,visible_ai
17025,22,https://www.reddit.com/r/gamedev/comments/18wj5wc/concept_artist_here_replaced_with_ai_looking_for/,"Concept artist here, replaced with AI, looking for career change, is technical art better?",,en,developer,negative,art,,h1,,True,negative,visible_ai
17026,22,https://www.reddit.com/r/gamedev/comments/1t0lygx/where_do_you_personally_draw_the_line_between_ai/,Where do you personally draw the line between “AI as a tool” and “AI slop” in game dev?,,en,developer,question,voice,,h2,,True,neutral,visible_ai
17027,22,https://www.reddit.com/r/gamedev/comments/167iied/the_game_ive_spent_35_years_and_my_savings_on_has/,The game I've spent 3.5 years and my savings on has been rejected and retired by Steam today,,en,developer,negative,general,voluntary,h3,,True,negative,general_discussion
17028,22,https://www.reddit.com/r/gamedev/comments/1rpuk6e/how_are_the_artists_among_you_surviving_the_ai/,How are the artists among you surviving the AI Apocalypse?,,en,developer,neutral,art,,h1+h2,,True,neutral,visible_ai
17029,22,https://www.reddit.com/r/gamedev/comments/1qdt5kq/ai_images_in_game_screenshots/,AI Images in game screenshots?,,en,developer,question,art,voluntary,h2+h3,,True,neutral,visible_ai
20729,22,https://www.reddit.com/r/Games/comments/196bta9/unrestricted_pest_control_pika_game_studio/,Unrestricted Pest Control - PiKa Game Studio - Top-down roguelite shooter with a unique room/floor mechanic where players exterminate bugs to clean the facility.,,en,developer,neutral,art,voluntary,h2+h3,,True,neutral,visible_ai
22100,22,https://www.reddit.com/r/gaming/comments/1rx95h7/why_isnt_ai_being_used_in_the_one_place_we_need/,Why isn't AI being used in the one place we need it? In NPCS!?,,en,player,positive,gameplay,,h2,,True,positive,visible_ai
17032,22,https://www.reddit.com/r/gamedev/comments/1097mt3/ai_generating_photorealistic_objects_pixelating/,AI generating photorealistic objects -&gt; pixelating them with pixel art app = pixel artists gone forever?,,en,developer,negative,art,,h1+h2,,True,negative,visible_ai
17034,22,https://www.reddit.com/r/gaming/comments/1pahpt6/valve_artist_responds_to_epic_games_ceo_tim/,"Valve artist responds to Epic Games CEO Tim Sweeney and more calling on Steam to drop the 'Made with AI' label: ""This is like saying food products shouldn't have their ingredients list... The only people afraid of this are the ones that know their product is low effort.""",,en,developer,negative,general,,h3,,True,negative,general_discussion
17037,22,https://www.reddit.com/r/gaming/comments/1rt6fhn/arc_raiders_is_replacing_most_of_its_ai_voice/,Arc Raiders is replacing most of its AI voice lines with real actors,,en,developer,neutral,voice,voluntary,h2+h3,,True,neutral,visible_ai
17046,22,https://www.reddit.com/r/gaming/comments/1s0n5ns/pearl_abyss_releases_official_statement/,Pearl Abyss releases official statement apologizing about Crimson Desert's AI-use,,en,developer,negative,art,discovered,h2+h3,,True,negative,visible_ai
17049,22,https://www.reddit.com/r/gaming/comments/1ediuxk/would_you_play_an_ai_written_and_voiced_game_why/,Would you play an AI written and voiced game? Why or why not?,,en,player,negative,voice,,h2,,True,negative,visible_ai
17053,22,https://www.reddit.com/r/gaming/comments/1jqgf7e/all_these_price_hikes_are_not_ever_going_to_reach/,All these price hikes are not ever going to reach the developers. Development is already being actively outsourced to lower cost regions and 3rd party outfits.,,en,player,negative,general,,h1,,True,negative,general_discussion
17056,22,https://www.reddit.com/r/gaming/comments/15v78l4/whats_your_genuine_opinion_on_using_ai_created/,What's your genuine opinion on using AI created contents in video games?,,en,player,neutral,gameplay,,h2,,True,neutral,visible_ai
22105,22,https://www.reddit.com/r/Games/comments/17p6fun/xbox_and_inworld_ai_partner_to_empower_game/,Xbox and Inworld AI partner to empower game creators with the potential of Generative AI,,en,developer,neutral,gameplay,,h1+h2,,True,neutral,visible_ai
22106,22,https://www.reddit.com/r/Games/comments/1i855k2/capcom_is_experimenting_with_generative_ai_to/,Capcom is experimenting with generative AI to help generate the “hundreds of thousands of ideas needed for game development”,,en,developer,neutral,general,,h1,,True,neutral,general_discussion
22108,22,https://www.reddit.com/r/Games/comments/wlicjv/how_far_are_we_from_ai_being_capable_of/,How far are we from AI being capable of generating convincing worlds and NPC's?,,en,player,positive,gameplay,,h2,,True,positive,visible_ai
17060,22,https://www.reddit.com/r/gaming/comments/11d9k0k/how_long_until_we_have_an_ai_generated_game/,How long until we have an AI generated game?,,en,outsider,positive,general,,h2,,True,positive,general_discussion
17064,22,https://www.reddit.com/r/gaming/comments/zpzqgr/artists_on_artstation_who_is_owned_by_epic_games/,Artists on Artstation (who is owned by Epic Games) are revolting over AI,,en,developer,negative,art,,h1,,True,negative,visible_ai
17066,22,https://www.reddit.com/r/gaming/comments/zy16do/would_like_to_share_with_you_my_latest_and/,"Would like to share with you my latest (and probably last) game, a visual novel ""Alien"", that tells you a story about creature that struggles to find it's place in the human world, with almost all graphic assets made with the help of AI artist.",,en,developer,positive,art,voluntary,h2+h3,,True,positive,visible_ai
22112,22,https://www.reddit.com/r/pcgaming/comments/1oxz16s/i_think_bo7_campaign_plot_is_made_by_ai_prompts/,I think BO7 campaign plot is made by AI prompts.,,en,player,negative,general,discovered,h2+h3,,True,negative,general_discussion
17076,22,https://www.reddit.com/r/gaming/comments/1okgulv/arc_raiders_genai_and_the_ethics_of_it/,Arc Raiders - GenAI and the Ethics of it,,en,player,negative,voice,,h2+h3,,True,negative,visible_ai
17077,22,https://www.reddit.com/r/gaming/comments/1oeejlt/electronic_arts_announces_partnership_with/,Electronic Arts announces partnership with Stability AI,,en,developer,neutral,general,,h1,,True,neutral,general_discussion
22127,22,https://www.reddit.com/r/Steam/comments/1hy06ik/does_steam_ai_policy_work/,Does Steam AI policy work?,,en,player,negative,art,discovered,h3,,True,negative,visible_ai
22128,22,https://www.reddit.com/r/Steam/comments/1h7n5v3/anybody_here_tried_releasing_a_mod_of_npcs_with/,Anybody here tried releasing a mod of NPCs with Chat-GPT to avoid Steam's anti-AI rules? ,,en,player,question,gameplay,,h3,,True,neutral,visible_ai
