article_id,source_id,url,title_hint,post_date,language,author_role,ai_stance,ai_type,disclosure_type,hypothesis_type,query_cluster,relevant_flag,post_stance_3,ai_visibility_group
19817,22,https://www.reddit.com/r/Steam/comments/1j6r4es/valve_should_outright_ban_games_that_uses_mostly/,"Valve should outright ban games that uses mostly, if not entirely uses AI generated assets",,en,player,negative,art,,h3,,True,negative,visible_ai
19821,22,https://www.reddit.com/r/Steam/comments/1hb5v98/how_can_i_report_a_game_that_i_do_not_own_for/,How can I report a game (that I do not own) for having generative AI content without disclosing it on their store page?,,en,player,question,art,,h3,,True,neutral,visible_ai
20175,22,https://www.reddit.com/r/gamedev/comments/16bhled/my_concerns_regarding_steams_ai_policy_and_what/,"My concerns regarding Steam's AI policy, and what it means for indie devs",,en,developer,neutral,art,,h3,,True,neutral,visible_ai
20176,22,https://www.reddit.com/r/gamedev/comments/18r8uj0/using_ai_generated_assets_in_games/,Using AI generated assets in games?,,en,developer,question,art,voluntary,h3,,True,neutral,visible_ai
20177,22,https://www.reddit.com/r/gamedev/comments/18g5lib/are_there_advanced_text_to_speech_systems_that/,Are there advanced Text to Speech systems that are confirmed acceptable to use for steam games? AI generated ones in particular?,,en,developer,question,voice,,h3,,True,neutral,visible_ai
20178,22,https://www.reddit.com/r/gamedev/comments/18qefn0/ai_generated_game_on_steam_how_is_it_possible/,"AI generated game on steam, how is it possible?",,en,player,question,art,voluntary,h3,,True,neutral,visible_ai
19834,22,https://www.reddit.com/r/IndieGaming/comments/1p3pvwo/as_an_indie_game_dev_i_refuse_to_use_ai_meanwhile/,"As an Indie Game Dev I refuse to use AI, meanwhile at Ubisoft:",,en,developer,negative,general,,h1,,True,negative,general_discussion
19835,22,https://www.reddit.com/r/IndieGaming/comments/1mtlj4t/i_think_that_ai_is_going_to_be_more_useful_that/,I think that AI is going to be more useful that people give it credit for in the indie space,,en,developer,positive,art,,h1+h2,,True,positive,visible_ai
19844,22,https://www.reddit.com/r/IndieGaming/comments/1ptjqwp/hypothetical_use_of_ai_in_solo_made_games/,Hypothetical Use Of AI In Solo Made Games,,en,player,question,art,,h1+h2,,True,neutral,visible_ai
19845,22,https://www.reddit.com/r/IndieGaming/comments/1l0bq0o/lets_discuss_ai_generated_content/,Let's discuss AI generated content,,en,developer,neutral,art,,h3,,True,neutral,visible_ai
20198,22,https://www.reddit.com/r/gamedev/comments/1do05hv/daily_reminder_to_disclose_any_ai_you_use_if_you/,Daily reminder to disclose any AI you use if you publish on Steam,,en,developer,neutral,tools,,h3,,True,neutral,internal_tools
19899,22,https://www.reddit.com/r/GameDevelopment/comments/1petido/im_concerned_about_my_ai_usage_in_game_development/,I'm concerned about my AI usage in game development.,,en,developer,question,tools,voluntary,h1+h3,,True,neutral,internal_tools
20202,22,https://www.reddit.com/r/gamedev/comments/1683yo2/is_there_a_line_between_aigenerated_and/,"Is there a line between ""ai-generated"" and ""ai-assisted"", and does it even matter to Steam?",,en,developer,question,art,,h3,,True,neutral,visible_ai
20203,22,https://www.reddit.com/r/gamedev/comments/1enao4e/new_ai_image_generator_and_steam_legal/,New A.I. image generator and Steam? Legal?,,en,developer,question,art,,h3,,True,neutral,visible_ai
20204,22,https://www.reddit.com/r/gamedev/comments/13vm59o/is_it_possible_to_use_aigenerated_assets_for/,Is it possible to use AI-generated assets for commercial purposes in the US/EU?,,en,developer,question,art,,h3,,True,neutral,visible_ai
20205,22,https://www.reddit.com/r/gamedev/comments/16vh4vs/why_stasis_bone_totem_is_allowed_to_have_ai/,Why STASIS Bone Totem is allowed to have AI generated assets?,,en,player,question,art,discovered,h3,,True,neutral,visible_ai
20207,22,https://www.reddit.com/r/gamedev/comments/16oh3nb/generative_ai_will_account_for_half_of_game/,Generative AI Will Account for Half of Game Development in 5-10 Years. More of the same?,,en,developer,neutral,general,,h1,,True,neutral,general_discussion
20209,22,https://www.reddit.com/r/gamedev/comments/15gb26r/can_i_use_an_art_generated_by_ai_in_a_steam_game/,Can I use an art generated by AI in a steam game if I purchased that art and have a license?,,en,developer,question,art,,h3,,True,neutral,visible_ai
17271,22,https://www.reddit.com/r/pcgaming/comments/1lojtet/i_honestly_believe_there_is_absolutely_a_place/,"I honestly believe there is ABSOLUTELY a place for utilizing AI in making games. Please hear me out, would love to hear your thoughts.",,en,player,neutral,general,,h1,,True,neutral,general_discussion
20165,22,https://www.reddit.com/r/Steam/comments/1n2lncx/ai_generated_content_tag/,AI Generated Content tag,,en,developer,question,tools,,h3,,True,neutral,internal_tools
20170,22,https://www.reddit.com/r/Steam/comments/1jnssgg/generative_ai_at_next_fest_fiasco_and_how_its/,Generative AI at Next Fest fiasco and how it's good for the industry,,en,player,neutral,art,,h3,,True,neutral,visible_ai
20181,22,https://www.reddit.com/r/gamedev/comments/1sd7px1/use_royalty_free_music_or_have_the_ai_generated/,"Use royalty free music, or have the AI generated content tag on steam. What is worse ?",,en,developer,question,voice,,h1+h2,,True,neutral,visible_ai
20186,22,https://www.reddit.com/r/gamedev/comments/1r5wwc3/use_of_ai_generated_content/,Use of AI generated content,,en,developer,question,art,voluntary,h3,,True,neutral,visible_ai
17326,22,https://www.reddit.com/r/Steam/comments/1pb5ei9/if_there_is_a_job_or_position_in_the_gaming/,If there is a job or position in the Gaming industry that should be replaced by AI look no further than the CEO,,en,player,negative,general,,h1,,True,negative,general_discussion
17332,22,https://www.reddit.com/r/Steam/comments/1p9n4ap/heres_my_take_on_valves_position_on_ai_as_someone/,"Here's my take on valve's position on AI, as someone who uses AI (for rapid prototyping)",,en,developer,positive,tools,,h3,,True,positive,internal_tools
20325,22,https://www.reddit.com/r/IndieGaming/comments/1sjnorm/2_years_solo_dev_first_outdoor_playtest_with_my/,"2 years solo dev — first outdoor playtest with my kids. 
AI enemies in full tactical gear, wave escalation, ballistic 
projectiles. Built in UE5 alongside a day job.",,en,developer,neutral,voice,voluntary,h2+h3,,True,neutral,visible_ai
17477,22,https://www.reddit.com/r/GameDevelopment/comments/1p5g17b/what_are_reasons_why_outsourcing_has_become_the/,What are reasons why outsourcing has become the industry standard,,en,developer,neutral,general,,h1,,True,neutral,general_discussion
17485,22,https://www.reddit.com/r/GameDevelopment/comments/1qp6y37/has_anyone_used_ai_dubbing_for_localization/,has anyone used AI dubbing for localization instead of hiring voice actors for every language?,,en,developer,question,voice,,h2+h3,,True,neutral,visible_ai
20421,22,https://www.reddit.com/r/gamedev/comments/1emvv3q/a_message_to_artists/,A Message to Artists,,en,developer,negative,art,,h1+h2,,True,negative,visible_ai
20431,22,https://www.reddit.com/r/Games/comments/1lqx8y3/over_20_projects_have_been_cancelled_this_year/,"Over 20 projects have been cancelled this year, are we seeing the collapse of AAA development ?",,en,player,question,general,,h1,,True,neutral,general_discussion
20438,22,https://www.reddit.com/r/gamedev/comments/1s8u03t/what_just_make_game_developers_work_faster/,What just make game developers work faster?,,en,developer,positive,tools,,h1,,True,positive,internal_tools
20439,22,https://www.reddit.com/r/gamedev/comments/1t98iwa/looking_for_developers_to_answer_questions_about/,Looking for developers to answer questions about generative AI for academic research - all experiences welcome,,en,developer,neutral,general,,h1+h2,,True,neutral,general_discussion
20442,22,https://www.reddit.com/r/gamedev/comments/1lygkac/ai_game_development_some_questions_from_someone/,AI &amp; Game Development | Some questions from someone working at an AI company,,en,developer,neutral,tools,,h1,,True,neutral,internal_tools
20445,22,https://www.reddit.com/r/gamedev/comments/1mmoqa7/first_experience_developing_and_publishing_the/,First experience: Developing and publishing the first video game,,en,developer,positive,art,voluntary,h2+h3,,True,positive,visible_ai
20446,22,https://www.reddit.com/r/gamedev/comments/1pigbpj/does_anyone_else_feel_this_way_about_ai_being/,Does anyone else feel this way about AI being used for programming in a small indie team?,,en,developer,neutral,tools,,h1,,True,neutral,internal_tools
20460,22,https://www.reddit.com/r/gamedev/comments/1q246es/notes_on_generative_llms_in_ue5/,Notes on Generative LLMs in UE5,,en,developer,neutral,gameplay,,h2,,True,neutral,visible_ai
20461,22,https://www.reddit.com/r/gamedev/comments/1qxw84z/project_genie/,Project Genie,,en,player,neutral,general,,h1+h2,,True,neutral,general_discussion
20481,22,https://www.reddit.com/r/gamedev/comments/15x0q5u/does_tim_sweeney_feel_the_same_way_as_john/,Does Tim Sweeney feel the same way as John Riccitiello when it comes to AI?,,en,developer,neutral,general,,h1,,True,neutral,general_discussion
20484,22,https://www.reddit.com/r/gaming/comments/1m0ivl6/candy_crush_developers_set_to_be_laid_off_by/,Candy Crush Developers Set To Be Laid Off By Microsoft Are Reportedly Being Replaced By The AI Tools They Were Told To Build,,en,player,negative,general,,h1,,True,negative,general_discussion
20018,22,https://www.reddit.com/r/gamedev/comments/1sut1u1/after_20_years_of_failed_solo_dev_i_finally_did/,"After 20+ years of failed solo dev, I finally did it… thanks to Ai",,en,developer,positive,tools,,h1,,True,positive,internal_tools
20493,22,https://www.reddit.com/r/gaming/comments/1rstsll/xbox_series_consoles_are_getting_gaming_copilot/,Xbox series consoles are getting Gaming Copilot later this year,,en,player,neutral,gameplay,,h2,,True,neutral,visible_ai
20495,22,https://www.reddit.com/r/gaming/comments/1oymy4i/discussion_buyers_should_start_to_tune/,Discussion - Buyers should start to tune expectations to an increase in quality/content and decrease in micro-transactions if Gen-AI is going to be used in all game development going forward,,en,player,negative,art,,h1+h2,,True,negative,visible_ai
20560,22,https://www.reddit.com/r/Steam/comments/1sw49x2/question_about_how_reviews_work_on_steam/,Question about how reviews work on Steam,,en,player,negative,art,discovered,h3,,True,negative,visible_ai
20618,22,https://www.reddit.com/r/IndieGaming/comments/1rv2qai/the_game_industry_is_going_through_a_revolution/,The game industry is going through a revolution and most developers aren't thinking about it clearly.,,en,developer,neutral,general,,h1+h2,,True,neutral,general_discussion
20630,22,https://www.reddit.com/r/IndieGaming/comments/1sov5ru/im_a_solo_developer_from_china_heres_the_newest/,I'm a solo developer from China. Here's the newest development progress for my space sandbox game 'Star Array',,en,developer,neutral,art,voluntary,h2+h3,,True,neutral,visible_ai
20640,22,https://www.reddit.com/r/IndieGaming/comments/1re7nld/i_built_gaim_game_ai_machine_the_first_game/,"I built GAIM - Game AI Machine, the first game generator that actually works 🎉",,en,developer,positive,general,,h2,,True,positive,general_discussion
20645,22,https://www.reddit.com/r/IndieGaming/comments/1qwgvs2/an_advice_for_game_assets_developers_fab/,An advice for game assets developers (FAB),,en,developer,negative,art,,h1,,True,negative,visible_ai
20651,22,https://www.reddit.com/r/GameDevelopment/comments/14fzlmt/ai_and_localization_friends_or_foes/,AI and Localization: Friends or Foes?,,en,developer,neutral,general,,h2,,True,neutral,general_discussion
20673,22,https://www.reddit.com/r/GameDevelopment/comments/1q31lo8/codex_mortis_is_not_100_ai_developed/,Codex Mortis is NOT 100% AI developed.,,en,developer,neutral,tools,voluntary,h1+h3,,True,neutral,internal_tools
20676,22,https://www.reddit.com/r/GameDevelopment/comments/1qwgwqx/an_advice_for_game_assets_developers_fab/,An advice for game assets developers (FAB),,en,developer,negative,art,,h1,,True,negative,visible_ai
20677,22,https://www.reddit.com/r/GameDevelopment/comments/1qd4p2z/new_technologies_now_available_for_game/,New Technologies Now Available for Game Developers including DLSS 4.5 Second Generation Transformer Model,,en,developer,neutral,voice,,h2,,True,neutral,visible_ai
20678,22,https://www.reddit.com/r/GameDevelopment/comments/1io2dic/do_you_think_that_game_development_and_game/,Do you think that game development and game design jobs will die with the advent of artificial intelligence ?,,en,player,question,general,,h1,,True,neutral,general_discussion
20706,22,https://www.reddit.com/r/gamedev/comments/12beq57/generative_ai_game_artists_how_big_is_it/,Generative AI &amp; Game artists - how big is it?,,en,developer,neutral,art,,h1+h2,,True,neutral,visible_ai
20800,22,https://www.reddit.com/r/pcgaming/comments/14otmi8/when_we_will_get_tailored_ai_generated_content/,When we will get tailored AI generated content for our games.,,en,player,positive,gameplay,,h2,,True,positive,visible_ai
20866,22,https://www.reddit.com/r/IndieGaming/comments/1ssx9tv/blood_and_power_free_text_base_browser_mafia_game/,Blood and Power - Free Text Base Browser Mafia Game,,en,developer,positive,voice,voluntary,h2+h3,,True,positive,visible_ai
17656,22,https://www.reddit.com/r/gaming/comments/1pz2chh/if_we_are_to_accept_that_game_development_uses_ai/,"IF we are to accept that game development uses AI, it should be tagged and game prices should go DOWN, not up.",,en,player,negative,general,,h1,,True,negative,general_discussion
20886,22,https://www.reddit.com/r/IndieGaming/comments/1t20i1g/ive_spent_the_last_year_building_a_browser_card/,I've spent the last year building a browser card game from scratch — Mythpact is finally ready for real players,,en,developer,positive,art,voluntary,h1+h3,,True,positive,visible_ai
20888,22,https://www.reddit.com/r/IndieGaming/comments/1si8k0t/i_rebuilt_acrophobia_the_classic_90s_aol_word/,I rebuilt Acrophobia — the classic 90s AOL word game — as a mobile app with real-time multiplayer and AI opponents,,en,developer,positive,gameplay,,h2,,True,positive,visible_ai
20889,22,https://www.reddit.com/r/IndieGaming/comments/1r3mhve/i_built_an_ai_merchant_npc_for_my_puzzle_game/,"I built an AI merchant NPC for my puzzle game - looking for playtesters to compare it against traditional shops (10 min, browser)",,en,developer,positive,gameplay,,h2,,True,positive,visible_ai
20902,22,https://www.reddit.com/r/IndieGaming/comments/1qv1mgr/curve_clash_im_an_accountant_who_built_a/,"Curve Clash – I'm an accountant who built a multiplayer snake game with AI tools, now running a Super Bowl event with live team scores",,en,outsider,positive,tools,,h1,,True,positive,internal_tools
20929,22,https://www.reddit.com/r/GameDevelopment/comments/1t33s1g/what_are_your_thoughts_on_this_ai_agents_in_rpg/,What are your thoughts on this ( AI Agents in RPG ),,en,player,positive,gameplay,,h2,,True,positive,visible_ai
20939,22,https://www.reddit.com/r/GameDevelopment/comments/1rdpta1/trying_to_make_a_living_world_engine_that/,"Trying to make a ""Living World"" engine that actually thinks. Am I onto something here?",,en,developer,neutral,gameplay,,h2,,True,neutral,visible_ai
20946,22,https://www.reddit.com/r/GameDevelopment/comments/1srp27v/i_vibecoded_a_synthetic_npc_dialogue_engine_over/,"I ""vibe-coded"" a synthetic NPC &amp; Dialogue engine over the weekend. Looking for brutal feedback.",,en,outsider,positive,voice,,h1+h2,,True,positive,visible_ai
20961,22,https://www.reddit.com/r/gamedev/comments/1pcc2aq/realtime_volumetric_pixel_art_billboard_my/,Realtime volumetric pixel art billboard - My attempt to describe the method to achieve the dark fantasy pixel art AI game style,,en,developer,neutral,art,,h2,,True,neutral,visible_ai
20963,22,https://www.reddit.com/r/gamedev/comments/1jem0a3/what_i_learned_integrating_ai_in_a_simple/,What I Learned Integrating AI in a Simple Multiplayer Game,,en,developer,neutral,gameplay,,h1+h2,,True,neutral,visible_ai
20964,22,https://www.reddit.com/r/gamedev/comments/1cou3co/using_ai_generated_marketing_materials_for_my_game/,Using AI generated marketing materials for my game,,en,developer,positive,art,voluntary,h1+h2+h3,,True,positive,visible_ai
20968,22,https://www.reddit.com/r/gamedev/comments/1in9dvq/unity_ceos_internal_announcement_amidst_the/,Unity CEO's Internal Announcement Amidst the Layoffs,,en,developer,neutral,tools,,h1,,True,neutral,internal_tools
20973,22,https://www.reddit.com/r/gamedev/comments/1ngswem/seeking_feedback_for_our_first_steam_game_store/,"Seeking feedback for our first Steam game - Store Page, Marketing Strategy &amp; Scope",,en,developer,neutral,art,voluntary,h2+h3,,True,neutral,visible_ai
20990,22,https://www.reddit.com/r/gamedev/comments/1qg9hyh/implementing_ingame_ai_assistant_is_llm_the/,"Implementing in-game AI assistant, is LLM the solution? What are other options?",,en,developer,question,gameplay,,h2,,True,neutral,visible_ai
20992,22,https://www.reddit.com/r/gamedev/comments/1r16etj/how_i_localized_my_games_was_it_worth_it_when_i/,How I localized my games: Was it worth it when I could do it with AI instead? What is the future of localization?,,en,developer,neutral,general,,h2+h3,,True,neutral,general_discussion
20996,22,https://www.reddit.com/r/gaming/comments/1nlyjxp/why_ai_mlm_written_npc_dialogue_will_never_happen/,Why AI MLM written NPC dialogue will never happen.,,en,developer,negative,voice,,h2,,True,negative,visible_ai
21106,22,https://www.reddit.com/r/IndieGaming/comments/1mcqpdz/need_feedback_2d_role_play_games_with_npc/,Need Feedback: 2D Role Play games with NPC characters powered by local AI models,,en,developer,positive,gameplay,,h2,,True,positive,visible_ai
21134,22,https://www.reddit.com/r/gamedev/comments/1n9dh5m/having_standout_artstyle_matters_more_than_ever/,"Having standout artstyle matters more than ever, in the age of AI",,en,developer,neutral,art,,h1+h2,,True,neutral,visible_ai
21135,22,https://www.reddit.com/r/gamedev/comments/1ltdwrf/a_serious_questions_about_llm_and_game_development/,A serious questions about LLM and game development.,,en,player,question,general,,h1+h2,,True,neutral,general_discussion
21112,22,https://www.reddit.com/r/IndieGaming/comments/1htwuby/just_released_my_ai_roleplaying_game_infinite/,Just released my AI Roleplaying Game: Infinite Adventure Simulator,,en,developer,positive,gameplay,voluntary,h2,,True,positive,visible_ai
21126,22,https://www.reddit.com/r/GameDevelopment/comments/1qw43e1/nvidia_at_gdc_2026/,NVIDIA at GDC 2026,,en,developer,neutral,voice,,h2,,True,neutral,visible_ai
21132,22,https://www.reddit.com/r/gamedev/comments/1p65lmd/almost_every_indie_game_project_i_have_ever/,Almost every Indie Game project I have ever worked on was met with EXTREME hostility...,,en,developer,negative,art,discovered,h1+h3,,True,negative,visible_ai
21149,22,https://www.reddit.com/r/gaming/comments/14bc887/the_change_to_gaming_cultures_mentality/,The Change to Gaming Culture's Mentality,,en,player,positive,gameplay,,h2,,True,positive,visible_ai
21150,22,https://www.reddit.com/r/gaming/comments/11xs3ab/ai_augmented_side_quest/,Ai augmented side quest,,en,player,positive,gameplay,,h2,,True,positive,visible_ai
21163,22,https://www.reddit.com/r/pcgaming/comments/1j79wky/whats_the_situation_on_ai_generated_quests_in/,What's the situation on AI generated quests in gaming right now?,,en,player,question,gameplay,,h2,,True,neutral,visible_ai
21174,22,https://www.reddit.com/r/gamedev/comments/1pr677z/how_should_devs_handle_curator_reviews_that_make/,How should devs handle curator reviews that make false ‘AI’ claims?,,en,developer,question,art,discovered,h3,,True,neutral,visible_ai
21177,22,https://www.reddit.com/r/gamedev/comments/1pptqpb/ai_for_game_characters/,AI for game characters?!,,en,developer,positive,gameplay,,h2,,True,positive,visible_ai
21185,22,https://www.reddit.com/r/gamedev/comments/1dw6n65/at_the_rate_ai_is_evolving_its_only_a_matter_of/,"At the rate AI is evolving, it's only a matter of time before people with zero programming or art skills start making and publishing games.",,en,developer,neutral,general,,h1+h2,,True,neutral,general_discussion
21188,22,https://www.reddit.com/r/gamedev/comments/1msym9p/free_unity_package_for_creating_aipowered_game/,Free Unity package for creating AI-powered game mechanics,,en,developer,positive,gameplay,,h2,,True,positive,visible_ai
21404,22,https://www.reddit.com/r/gamedev/comments/1qka3tf/what_i_learned_building_my_first_game_with_ai/,What I learned building my first game with AI tools: A 38-year-old accountant's journey to shipping a multiplayer mobile game,,en,outsider,positive,tools,,h1,,True,positive,internal_tools
21443,22,https://www.reddit.com/r/gaming/comments/1niqhnq/cheapass_company_ea_sports/,Cheapass company EA Sports.,,en,player,negative,art,discovered,h2+h3,,True,negative,visible_ai
21583,22,https://www.reddit.com/r/Steam/comments/1b5iwxf/does_steams_ai_disclosure_policy_apply_to_things/,does steam's ai disclosure policy apply to things such as promotional images/other things related to the game?,,en,developer,question,art,,h3,,True,neutral,visible_ai
21584,22,https://www.reddit.com/r/Steam/comments/1rgq4a3/is_the_ubisoft_publisher_sale_ad_on_the_front/,"Is the Ubisoft Publisher Sale ad on the front page of the Store AI generated, and if so, why is this allowed?",,en,player,question,art,discovered,h3,,True,neutral,visible_ai
21747,22,https://www.reddit.com/r/Games/comments/1qz4t4o/the_milgram_experiment_theseus_games_first_person/,"The Milgram Experiment - Theseus Games - First Person Unsettling Ethical Dilemmas Game With Elements Of Liminal Horror And Inspired By The IRL Experiment, Demo Out In 2 days",,en,developer,negative,art,,h2+h3,,True,negative,visible_ai
21808,22,https://www.reddit.com/r/Steam/comments/15cjgo0/has_anyone_seen_any_new_games_showing_up_on_steam/,Has anyone seen any new games showing up on Steam which use ChatGPT or other LLM's to generate in-game content/dialog?,,en,player,neutral,gameplay,,h3,,True,neutral,visible_ai
21861,22,https://www.reddit.com/r/gamedev/comments/1pjs630/people_are_so_eager_to_hate_on_ai_art_yet_they/,"People are so eager to hate on AI art, yet they can't recognize it and even seem to like it. What's up with that? Recent post on r/GameArt",,en,developer,neutral,art,discovered,h2+h3,,True,neutral,visible_ai
21863,22,https://www.reddit.com/r/gamedev/comments/17cj0xl/anyone_opposed_to_ai_game_assets_may_want_to_join/,Anyone opposed to AI game assets may want to join the protest tomorrow,,en,player,negative,art,,h1+h2,,True,negative,visible_ai
21864,22,https://www.reddit.com/r/gamedev/comments/1l7dm87/do_you_think_ai_will_be_able_to_create_game/,Do you think AI will be able to create game assets flawlessly in the near future?,,en,developer,neutral,art,,h1+h2,,True,neutral,visible_ai
21867,22,https://www.reddit.com/r/gamedev/comments/1bqg0l1/how_do_people_currently_feel_about_ai_art_being/,How do people currently feel about AI art being used as a base for game assets?,,en,player,neutral,art,,h2+h3,,True,neutral,visible_ai
21888,22,https://www.reddit.com/r/gaming/comments/1dh6jwa/remember_the_milo_tech_demo_on_xbox_aka_project/,Remember the Milo tech demo on Xbox (aka Project Natal)? That should mostly be possible now right?,,en,player,positive,gameplay,,h2,,True,positive,visible_ai
21892,22,https://www.reddit.com/r/gaming/comments/1abagqf/whats_wrong_with_generative_ai/,Whats wrong with generative AI?,,en,player,question,art,,h1+h2,,True,neutral,visible_ai
21908,22,https://www.reddit.com/r/Games/comments/137r2k5/blizzard_has_registered_a_new_patent_to_use_ai/,Blizzard has registered a new patent to use AI generated graphics in their video games,,en,developer,neutral,art,,h1,,True,neutral,visible_ai
21909,22,https://www.reddit.com/r/Games/comments/mytx3n/could_intelligent_ai_generation_be_the_future_of/,Could intelligent AI generation be the future of game design?,,en,player,positive,general,,h1+h2,,True,positive,general_discussion
18034,22,https://www.reddit.com/r/gamedev/comments/1tdq6am/what_are_your_thoughts_on_aiassisted_creation_in/,What are your thoughts on AI-assisted creation in game dev?,,en,developer,question,art,voluntary,h2,,True,neutral,visible_ai
21975,22,https://www.reddit.com/r/IndieGaming/comments/1ti6yo9/ive_been_building_an_incremental_about_running_an/,"Ive been building an incremental about running an AI startup inside a
fake OS. First time sharing it, would love some honest feedback",,en,developer,neutral,tools,voluntary,h1+h3,,True,neutral,internal_tools
21980,22,https://www.reddit.com/r/IndieGaming/comments/1thtjwk/built_an_ai_narrative_story_maker_because_life/,"Built an AI narrative story maker because life lacks adventure, looking for feedback",,en,developer,positive,gameplay,,h2,,True,positive,visible_ai
18097,22,https://www.reddit.com/r/gaming/comments/1lbwwo0/ai_usage_in_indie_game_development/,Ai usage in indie game development,,en,player,question,general,,h1+h2,,True,neutral,general_discussion
21985,22,https://www.reddit.com/r/IndieGaming/comments/1rjxl6x/would_you_tolerate_short_loading_moments_for/,Would you tolerate short loading moments for generative AI world updates in an open-world RPG?,,en,developer,question,gameplay,,h2,,True,neutral,visible_ai
22002,22,https://www.reddit.com/r/IndieGaming/comments/1rvrfla/first_passion_project_as_a_solo_dev_an_unscripted/,First passion project as a solo dev: An unscripted nightclub RPG where every NPC runs on a local LLM,,en,developer,positive,gameplay,,h2,,True,positive,visible_ai
